universe_id,game_name,det_at,det_ccu,week_ago_ccu,growth_percent,video_titles,channels,n_videos
9875490438,Open Sea For Brainrots!,2026-04-05,13193,10471,25.99560691433483,MYTHICAL LUCKYBLOCK In Escape Tsunami for Brainrots Roblox to Pro Guide #brainrot #roblox || MYTHICAL LUCKYBLOCK In Escape Tsunami for Brainrots Roblox to Pro Guide #brainrot #roblox || NEW EASTER BRAINROTS in Break a Lucky Block! 🐰😱 #roblox #shorts #stealabrainrot || Open Sea For Brainrots!🤪 Playing with subs!! 🤩 PART 186,bekerslebew || Beker Art || BearModeWiFi || Leonard Plays Roblox,4
9362896961,[2x💵] Anime Card Collection,2026-04-05,15663,12213,28.24858757062147,"My driving empire cars,helicopters,bikes and boat     collection  || Sneaking Into A Secret Car Collection In Driving Empire",Mustakim gaming ghost  || FreshRambo,2
1393178180,[Spring🌻] Polish Car Driving,2026-04-05,1698,677,150.81240768094534,UKRYTE MIEJSCA W POLISH CAR DRIVING! 😱 (Tego nie wiedziałeś) || WŁAŚCICIEL SERWERA PCD ODPOWIADA NA PYTANIA - Hogaty i Amax w Roblox - Polish Car Driving || DZIEŃ Z ŻYCIA KIEROWCY TIRA w Polish Car Driving! 🚛 || Pov: Polish car driving,KubaZiutek || LeHogaty || KubaZiutek || Patryk_granie,4
7436755782,[🔥] Grow a Garden 🌶️,2026-04-05,157309,59342,165.08880725287318,JANDEL IS BACK!!! GROW A GARDEN (EASTER UPDATE) || HOW TO GET EGGFRUIT SEED FAST!! (Easter Update) in Grow a Garden ROBLOX || HOW To Get NEW CANDY BLOSSOM for Free (Easter EggFruit) in Grow A Garden! ROBLOX || HOW To Get CHOCOLATE COINS FAST In GROW A GARDEN! (EASTER EVENT) || FULL GUIDE To The EASTER 2026 UPDATE In GROW A GARDEN! (Roblox) || NEW EASTER BUNNY PET in Roblox Grow a Garden || Aku Cobain UPDATE Terbaru EASTER 2026 Buatan JANDEL Di Grow A Garden Dan Ini Bagus Banget... || New EASTER EGGFRUIT SEED in Roblox Grow a Garden || Jandel Is returning To Grow A Garden😱 || GAG COMEBACK! Admin Abuse PALING NOSTALGIA &amp; Update BESAR EASTER 2026 Grow A Garden,KreekCraft || TheOfficial Fuzion || Brockenskull Gaming || Abooga1 || Codezzy || RFG || Hannby || RFG || 1L_Crocodillo || Mqss Gaming,73
7414497778,[MTC] Multicrew Tank Combat,2026-04-05,3273,2488,31.55144694533762,#beat || #beat,YuitoPH || Elementery Squad,2
4839802560,LifeTogether 🏠 RP ,2026-04-05,50084,37040,35.21598272138229,"2 REALISTIC GIRLS Tried to DATE ME in LifeTogether RP For 24 hours Roblox || Me playing a life together rp || BABY RAY Is HEARTBROKEN In LifeTogether 🏠 RP | Roblox || REALISTIC TRIPLETS TRYOUT For CHEER | Roblox Life Together Rp Snapchat || UNE FILLE FLIPPANTE S&#39;INFILTRE DANS NOTRE SOIRÉE DE MECS 🏠 LifeTogether RP || We Went UNDERCOVER As POPPY PLAYTIME TWINS For 24 HOURS In LifeTogether 🏠 RP| Roblox || Life together rp in Roblox famous game in Roblox ♥️#robloxgame #Maryplayz || #roblox #lifetogther healing my dying kid in hospital  LIFETOGETHER RP🏠 || Lifetogether RP Weekend April 5, 2026 - Replay || Glitching into houses on Life Together RP! #roblox #fypシ #fyp #funny #smallcontentcreator #blowup",AURA RP  || Ta'Lajah || RaylashonRP || Royale Dior || Friblox Brookhaven || Raylashon || Mary Playz || Jacob Wonders 3 || Roblox Trainrides  || l0$3r,18
1525626450,(🚀 UPDATE) Rensselaer County,2026-04-05,6461,5106,26.53740697218958,Dress to Impress Is Falling Apart?! Tokyo Update Sparks Community Chaos,Froggyxo.,1
8834587397,Find the Brainrot [508],2026-04-05,2996,2166,38.28756058158319,BE A LUCKY BLOCK #roblox #robloxshorts #gaming #brainrot || I got Sammy Lucky Block 😱 Enter Brainrot Heads #roblox #shorts #robloxshorts || Rumi menjadi lucky blok dan gacha brainrot #roblox || MYTHICAL LUCKYBLOCK In Escape Tsunami for Brainrots Roblox to Pro Guide #brainrot #roblox || MYTHICAL LUCKYBLOCK In Escape Tsunami for Brainrots Roblox to Pro Guide #brainrot #roblox || Insane Admin Abuse Event in Roblox | Be a Lucky Block &amp; Brainrot Evolution New Brainrots Unlocked || 🔴LIVE - Steal a Brainrot USING THE NEW TRADE MACHINE TO TRADE! #stealabrainrot #sab #trading #roblox || New brainrot in break a lucky Block #roblox || NEW EASTER BRAINROTS in Break a Lucky Block! 🐰😱 #roblox #shorts #stealabrainrot || I Collected ALL 7 NEW EASTER BRAINROTS in Break a Lucky Block!,HSB GAMERZ || ALIF FUN TIME || Rama TUBE Chill || bekerslebew || Beker Art ||  Gmod Hoppy Playground || Shadow_Strike || BiwanBlox || BearModeWiFi || BearModeWiFi,11
6075694711,Brace,2026-04-05,1354,917,47.53473168074095,LUCKY BLOCK LOS CROCODILLITOS ROBLOX #games #trancegaming #roblox || 2067 Horse Power Drag Race (Driving Empire) || |&quot;Driving Empire Roblox Gameplay | Epic Cars &amp; Races! |#subscribe || NO ONE Expected THESE Characters in Jujutsu Shenanigans April Fool&#39;s Update... || TZE JUST RUINED THESE CHARACTERS IN JJS 💀#jujutsushenanigans #jjs  #roblox || Break a lucky block 🤯💀#roblox #robloxshorts #robloxgameplay #robloxgames #robloxtrend #robloxedit || Break a lucky block 🤯💀#roblox #robloxshorts #robloxgameplay #robloxgames #robloxtrend #robloxedit || Break a lucky block 🤯💀#roblox #robloxshorts #robloxgameplay #robloxgames #robloxtrend #robloxedit || Break a lucky block 🤯💀#roblox #robloxshorts #robloxgameplay #robloxgames #robloxtrend #robloxedit || BREAK A LUCKY BLOCK!! - roblox indonesia,Trance Gaming || Roblox Car Games Reviews || A.M Gaming World  || NightL || Exrezy || isagi || Mikey Gaming || MIKEY GAMER || YUTAA GAMING  || BOMAYE,18
4949420752,Realistic Street Soccer,2026-04-05,11448,8831,29.634243007586907,REALISTIC TRIPLETS TRYOUT For CHEER | Roblox Life Together Rp Snapchat,Royale Dior,1
2992873140,Emergency Hamburg,2026-04-05,24116,16997,41.87968818943963,I tried to stop the train in Emergency Hamburg with the new building update || Emergency Hamburg Easter Update 🤯🤫 #trend #memes #capcut #edit #easter #update #roblox #games || La PEOR actualizacion de Emergency Hamburg? || Trolling as a fake noob in Emergency Hamburg 😂✌️ || V3.14 Update So Cool in Emergency Hamburg #roblox || serwer dc serwera emergency Hamburg . https://discord.gg/mnZNEzqfW || Ich spiele Emergency Hamburg (Mit Zuschauern) || CRIME BASE BAUEN und VERTEIDIGEN in NOTRUF HAMBURG  | ROBLOX Deutsch Emergency Hamburg || Sprawdziłem Nowy Update w Emergency Hamburg!  *za mocne* || There is already a new V3.14 update in emergency hamburg,Rescue Play || MilanEH🅥 || Mixer783 || BHxShadow || Digital Gaming  || spocony_craked! || Nitchge || Gamingarea || Łuki || Aleksus,27
5215846239,Freestyle Football,2026-04-05,247,176,40.340909090909086,43-20 COMEBACK IN NFL UNIVERSE FOOTBALL,WaJelloCall,1
3168615253,Ability Wars,2026-04-06,3761,1028,265.85603112840465,Playing Roblox flee the facility  || Just Get BETTER | Ability wars #roblox #abilitywars || AN ABILITY WARS EASTER! || The ability Wars Easter update is here.The golden egg spawned but couldn&#39;t get it. :( || Random video i Forgot bout Ability wars or smth || Ability wars Portal showcase! || Bone Mastery Showcase / Ability wars / #roblox #abilitywars || an hacker in roblox ability wars || Roblox Bat Wars! || люблю ability wars #roblox #сваты6 #live #роблокс,King panda 2437 || Yoxxeri || valkyriedownload || golden_floppa || Error404-fr || TheRealDoggo || Mini || c00ldude || Corvo || гостер,12
1176784616,[🟣 HARDCORE]  Tower Defense Simulator,2026-04-06,15965,7605,109.91387811452238,Tower Defense Simulator | Ducky&#39;s Revenge | Solo Easy Mode (Bunny Skins Only) || Can This Strategy of mine beat Frost Mode!? #towerdefensesimulator #roblox #tds #shorts || Tower Defense Simulator Easter Update || Why I think Tower Defense Simulator is actually a Good Game || Tower Defense Simulator Gameplay #42  || 🔴Tower Defense Simulator Live 2026 || Duo Ducky Revenge in TDS! | Tower Defense Simulator | Roblox || This new Toilet tower defense legacy game is peak! sub so i can become partner in this game || O poder absurdo do jetpack cameraman no legacy Toilet Tower defense 🤯,Honeysocks || VantaRB || Justin || Cosmical Blur || Coblox || Isaiahcore || YooLoaf || TotallyBad || Breno0127x,9
9908641400,Football Fusion 3,2026-04-06,2640,1809,45.8966565349544,FASTEST 40-YARD DASH IN ROBLOX FOOTBALL! #roblox #nfl #nfluniversefootball #footballfusion2,Juicy John,1
1202096104,[✨NEW LIMITED✨] Driving Empire 🏎️ Car Racing📦RP,2026-04-06,36827,22169,66.11560928302399,Driving Empire  car Racing   || DRIVING EMPIRE INFINITE MONEY BUG(2026) || Driving empire car racing  || Sneaking Into A Secret Car Collection In Driving Empire || I played Roblox driving empire  || Porsche Macan Turbo Electric Drag Race (Driving Empire) || Renault Clio V6 Review (Driving Empire) || Kupiłem nowe auto w Polish Car Driving! Polish Car Driving #2,ATVBOY || HUN || HUN || FreshRambo || Gaming time with Zuuks || Roblox Car Games Reviews || Roblox Car Games Reviews || Fan Roblox,8
4987856151,Wanted [✈️UPDATE],2026-04-06,2565,1692,51.52857775808596,water your plants a different way #grow a garden #roblox,Minecraft brother ,1
4457060041,Emergency Emden,2026-04-06,4865,2418,101.15774240231548,Top 4 best players of emergency hamburg(cop edition) #sound #roblox #emergency #super #emergancyham || bro don`t trust school bus #roblox #Emergency Hamburg || So guys today I&#39;m playing emergency Hamburg Roblox this video for who have no money || 🔴 LIVE RP FR EMERGENCY HAMBURG #shorts #roblox || Momentos Random De Emergency Hamburg XD | Roblox || 🔴Live Roblox Emergency Hamburg vient vite...!! || RF is a Roblox Emergency Hamburg Gang  it&#39;s a old gang so we closed it but I want to open it 🥹. #plz || ROBLOX Emergency Hamburg as criminal duo || Getting 500 XP as Police IN Emergency Hamburg (atleast i tried) | PS4 || emergency hamburg #emergency #roblox #7077 #crim #police #ryszard #numb #shorts #video #discord #bug,EH_Block47 || MIKAEL LK || Legend_Badboy || Rocsel Studio || Papafrita+ || Terrogator || DEVPLAYZ_YT || thatguy || Aarav_carz 🚗 ☬ || NBD-RYSZARD7077,37
9739361789,[🐰 UPDATE] Legacy Toilet Tower Defense,2026-04-06,2310,515,348.1086323957323,This new Toilet tower defense legacy game is peak! sub so i can become partner in this game || O poder absurdo do jetpack cameraman no legacy Toilet Tower defense 🤯,TotallyBad || Breno0127x,2
9875383684,Be a Brainrot,2026-04-06,38896,10618,266.3213411188548,🔴LIVE - Steal a Brainrot USING THE NEW TRADE MACHINE TO TRADE! #stealabrainrot #sab #trading #roblox || Be a Lucky Blocks Playing Live || New brainrot in break a lucky Block #roblox || Be a Lucky Block New Event🍀 #roblox #robloxmemes #robloxedit #robloxshorts #robloxtrend || NEW EASTER BRAINROTS in Break a Lucky Block! 🐰😱 #roblox #shorts #stealabrainrot || I Collected ALL 7 NEW EASTER BRAINROTS in Break a Lucky Block! || Open Sea For Brainrots!🤪 Playing with subs!! 🤩 PART 186 || Be a Lucky Block #Roblox #robloxlive #Shorts #Bealuckyblock || Be a Lucky Block #Roblox #robloxlive #Shorts #Bealuckyblock || Ubgraded base reveal Break A Lucky Block almost 100th on the Leadeboard #roblox #gaming #brainrot,Shadow_Strike || Aixi gaming  || BiwanBlox || CLASHBOOMCOC || BearModeWiFi || BearModeWiFi || Leonard Plays Roblox || Gaming YT kISHAN || Gaming YT kISHAN || ZmauGaming😎,35
5203828273,Dress To Impress⭐,2026-04-07,92339,59840,54.309372415003224,don&#39;t try this banned glitch on the dress to impress #roblox #robloxoutfit || Baddie Elsa 💙 Frozen | Dress to Impress MEMES 😂 #roblox #dresstoimpress #shorts #dtiroblox || dia 1 haciendo trend virales en roblox #dresstoimpress #edit #dress #impress #ouftis #roblox #outfit || how to go into vip #dress to impress#roblox #RUBIES799 || Dress to impress update if u missed!💕🤭#roblox#dti#update# || i won dress to impress for the first time ❤️💖#roblox #usacontent #dresstoimpress || Everything free we got in the new DRESS TO IMPRESS update#dti || Roblox games with Subscribers Dress to Impress #roblox #live #gaming || dress to impress roblox 😍🥳 || NEW UPDATE IN DRESS TO IMPRESS!,Roblox_with_anya301 || PlayWithSidYT || Gato_735 || RUBIES play  || erin || TURBOCHIC GAMER || Azuriex(>⁠.⁠<) || gamewithjsh || Preetha Laveen || versh,56
1157126388,BEAR (Alpha),2026-04-07,1042,530,96.69811320754717,#beat,unlucky gamer ,1
9774981774,[☀️ SINGULARITY] Re:Rangers X,2026-04-07,31993,19018,68.22041696243132,"I Obtained 0.1% SOVERIGN Carrot &amp; Megumin In Re:Rangers X! (Roblox) || Obtaining BUNNY FULL MOON Duplicator Exclusive In Re:Rangers X Update 4! || RE RANGERS X NEW EASTER UPDATE 4 ! The BEST Easter eggs farm 16 seconds stage clear || 🔴 LIVE 🐣 EASTER Update Is HERE! 🐣(New Units, Modes &amp; QOL) 🎉 | Anime Rangers X || 🔴Live ลุยอีเว้นใหม่Upd4 | Roblox Anime Rangers X || 🔴*LIVE* Easter Update With Viewers! (Re:Rangers X) || THE BOSS DEU RERROLS de GRAÇA NA UPDATE do ANIME RANGERS X... || สรุปอัปเดต 4 (โค้ดใหม่) อีเว้นท์อีสเตอร์!! : Anime Rangers X || INDO DO 0 AO 100 NO Anime Rangers X Ep 1 || สรุปอัปเดท 4.0 Easter ปลดล็อครางวัลเลเวล 350 แจกโค้ดใหม่ | Re:Rangers X",imCosmi || MrRhino || Fire Fist || Revex || Masayume || imCosmi || oSlawer || Reclovery || Erkan o macaco das gameplays || 10Baht Gamer,48
4938220315,[YOURSELF TOWER] Skibi Defense,2026-04-08,5674,3685,53.95468728802062,สอนวิธีผ่านด่าน Brainrot Base สายฟรี (Legacy toilet Tower Defense) || Easy Mode Hard Mode Insane Mode in Legacy Toilet tower defense  || Everything about the Easter Update | Roblox Legacy Toilet Tower Defense,LTTD_23 || xtomalt5 || BlockyChaos,3
6325068386,[❄️ HIORI] Blue Lock: Rivals,2026-04-08,18145,14246,27.3690860592447,#1 underground aimer in rivals | FULL MONTAGE LINKED BELOW #robloxrivals #roblox #rivals || New Trend Unlocked 🔥 #trend #roblox #rivals || I Got The GOLD Medkit In Roblox Rivals || #rivals || #rivals || he said wat #roblox #rivals || No way im letting them kill my friend | Roblox Rivals || The Best Loadouts For Your DEVICE In Roblox Rivals,holingly || Bro and Bro || DemonStudios  || Diatio || KBL... || tsumisauce || TornadoX || quackben,8
7785400752,ZOO or OOF🎯,2026-04-09,18832,3789,396.9521044992743,Playing zoo of oof || ZOO OR OOF #roblox #shorts || zoo or oof || ROBLOX ZOO ou OOF AO VIVO! #roblox || Play zoo or oof with my friends || Jogando zoo ou oof no Roblox || Zoo Or Oof CRAZIEST Clutches!! 🦒 || 🔴『LIVE』Meylow selematkan penguin di zoo negara! 😨| ROBLOX ZOO OR OOF || Playing Zoo Or Oof!  || ZOO or OOF🎯: Caçador atras de animal,Zrinxq  || Pheohn || Merri Brewster || Dipirona123 || KimdokiMini || futuin gamer || @shinyvanillafoil 🎉 || Meylow  || Bearry  || Fabzinhu,19
8181391950,[UPD] Neo Tennis,2026-04-09,11865,1913,520.2300052273915,Playing Neo Tennis on roblox || I became the master of tennis in Roblox! || NEO TENNIS (Roblox) || Neo tennis #roblox || Neo tennis  || 100 Days 100 Roblox Games / Neo Tennis / Day 8 || Neo tennis ,GeneralSeekPlayz 2 || Olyyt || Unstoppableplayz || cute veloger Dharsh portugal  || Sharv Gawali || ZackYT || Jax plays,7
9145063979,⛏️Dig to Escape,2026-04-10,12972,9445,37.34250926416093,Bắt Đầu Lại Với INFINITY MỚI Trong Escape Tsunami For Brainrots | Xuyen Roblox,Xuyen Roblox Gaming,1
7883776681,Racket Rivals ,2026-04-10,15057,11007,36.794766966475876,Knife Clip Rivals,GamerPlayz,1
9898970160,+1 Speed Be a Lucky Block!,2026-04-10,19633,12421,58.062957893889376,Noob Finding Secrets in Break a Lucky Block #roblox #robloxgames #robloxvideos || how to make a game like ⛏️ Break a Lucky Block || on steal a brainrot and break a lucky block || The break a lucky block admin aduse (AA) || I Stayed a LUCKY BLOCK for 24 HOURS… and REGRETTED IT 😱🍀 (Roblox) || Look at my friend base in  break a lucky block || Easter brainrots in break a lucky block roblox 🐰#roblox #shorts #breakaluckyblock || Be a Lucky Block #Roblox #robloxlive #Shorts #Bealuckyblock || Be a Lucky Block #Roblox #robloxlive #Shorts #Bealuckyblock || Be a Lucky Block #Roblox #robloxlive #Shorts #Bealuckyblock,LunaaahBlox || Just a roblox Dev  || SoundOfMarbleRun || Nataly Vargas || Selim mg  || Aiden The Gamer || Roblox Game || Gaming YT kISHAN || Gaming YT kISHAN || Gaming YT kISHAN,25
9918678725,Skateboard for Brainrots,2026-04-11,29214,19774,47.739455851117626,Open Sea For Brainrots #roblox #livegameplay #stealabrainrot #livestreaming #gamingytkishan12 || 100x LUCK mit SPECIAL SPAWN MASCHINEN Trick in Escape Tsunami for Brainrots! || BROKEN MINIGAME WIN GLITCH in Escape Tsunami For Brainrots || STEAL A BRAINROT 🧠💰 (LIVE TRADING) #stealabrainrot  #sabtrading  #roblox || The Most Hated Brainrot in Escape Tsunami for brainrots! || 😱CAMBIO DE HORARIOS😱ADMIN ABUSE😱PINTANDO BASES DE PASCUA🐰STEAL A BRAINROT || STEAL A BRAINROT GIVEAWAY LIVE | STEAL A BRAINROT FREE SECRETS + FREE BRAINROT GODS || Steal a Brainrot THEY&#39;RE STEALING MINE 107 #stealabrainrot || STEAL A BRAINROT GIVEAWAY LIVE | STEAL A BRAINROT FREE SECRETS + FREE BRAINROT GODS || STEAL A BRAINROT UPDATE!!!!!! #brainrot #roblox #games #stealabrainrot,Gaming YT kISHAN || KIDDOMAVE || RazorFishGaming ||  1nOnlyGod || Saven  || iFres || Joxy || Linda Roblox Live || SaGePlays || GOOSEYTHE1ST,12
7996365376,[🌴] SHARP,2026-04-11,12004,9259,29.646830111243116,Be a Brainrot #roblox #liveroblox #Newgame #livestreaming #robloxgames #kishanplays || Be a Brainrot #roblox #liveroblox #Newgame #livestreaming #robloxgames #kishanplays || CAR DRIVING INDONESIA - ROBLOX #liveshort #short #mediashareon || film już na kanale #roblox #robloxgame #polishcardriving || AR clip as y&#39;all said#comment #likeandsubscribe #share#roblox#rivals #assaulrifle#7x7#nobatidao#beat || THIS ADOPT ME PLAYER WAS POOR INTEL... @StarpetsUS Participating in the StarPets contest! || HOW TO GET CANDY BLOSSOM SHARDS IN GROW A GARDEN EASTER UPDATE!,Gaming YT kISHAN || Gaming YT kISHAN || FerryFarhann || gracz || St Gamers || The cutecore girl! || Abooga1,7
3240075297,Berry Avenue 🏠 RP,2026-04-11,45015,34998,28.62163552202983,Come with me in los angeles | Berry avenue rp || My Handsome Neighbor is a Vampire | Berry Avenue Rp  ( Roblox ) || BERRY AVENUE TODDLER OUTFITS!! 🩵☁️ #robloxrp #berryave #roblox #bloxburg #brookhaven #berryavenuerp || BERRY AVENUE TODDLER BOY HAIR!! 🩵🧸 #berryave #roblox #robloxrp #brookhaven #bloxburg #berryavenue || I TURNED My Mom INTO STONE... 😭😨 #roblox #shorts #berryavenueroleplay || I FAKED Having a BOYFRIEND... and He Actually SHOWED UP! on BERRY AVENUE RP Roblox story *VOICED* || VIAJE A SEUL CON MI FAMILIA 😱I Parte 3 I Berry Avenue RP I || RICH BOY BULLIES ME… then FALLS IN LOVE (Berry Avenue RP)  || FAMILY VACATION DAY IN OUR SUMMER HOUSE!! 💛🌊 *VOICED* BERRY AVENUE RP || I Got *DETENTION* at SCHOOL.. Berry Avenue Roleplay,Avensya  || Sweet Berry || Dreaming Hill || Dreaming Hill || Kumi || Daisy Brookhaven || Mochito Rol || Royale Luna || Dreaming Hill || Starxy,12
9491545867,[💎] Break a Brainrot Egg!,2026-04-11,12235,9063,34.99200088266122,Break a Lucky Block on Roblox #roblox #robloxedit #robloxshorts || Break a lucky  block  ✅️ || ￼Roblox break a lucky block || Break a lucky block || Break a lucky block || Roblox Break a lucky block || Be a Brainrot #roblox #liveroblox #Newgame #livestreaming #robloxgames #kishanplays || Be a Brainrot #roblox #liveroblox #Newgame #livestreaming #robloxgames #kishanplays || Admin Abuse + Update &amp; Trading Live In (Steal A Brainrot) #stealabrainrot #roblox #livestream || Today is giveaway and n Roblox break a lucky block add me my name is poke84429,LunaaahBlox || Anamika mourya  || Rivals player || TP Tanish gamer || Everest Karki || tocgameingroblox || Gaming YT kISHAN || Gaming YT kISHAN || YOUTUBE-ASGHAR || I love Roblox and Minecraft,52
9751761702,[🪙UPD] Throwing Simulator🎯,2026-04-11,16990,6412,164.9719276356831,Throwing Simulator Explained || ကျွန်တော်ပစ္စည်းအစုံကိုလွှင့်ပစ်ခဲ့တယ်| Throwing Simulator-Roblox #roblox#Renote#robloxgames || กากไปเทพ throwing simulator roblox🚀 || ATÉ ONDE UM TELESCÓPIO VAI no Throwing Simulator? 😱🚀 || Can I hit 100M Studs? 🏎️💨 Throw Simulator Roblox #ThrowSimulator #RobloxSimulator #RobloxNoobToPro || BABİ İLE TUTTUĞUMUZ HER ŞEYİ FIRLATTIK 😂 Roblox Throwing Simulator || 100 DAYS 100 ROBLOX GAMES (DAY 7) Game Name: Throwing Simulator #roblox #xehnix #gaming #robloxedit,groggydino || Renote ||  katanyukun || RNRUAN BR || TwinsyLand Gaming || Sefa Gülhan || Xehnix,7
6931042565,[UPD] Volleyball Legends,2026-04-11,48542,37585,29.15258746840495,atualização volleyball legends  #haikyuulegends #roblox #vbl #volleyballlegends || isso é papo de undaiá #haikyuu #roblox #volleyball #gaming #legends #volei #games #voleibol #volley || TEAMING UP WITH TWO TOP 25 SPIKERS IN SEASON 14 OF VOLLEYBALL LEGENDS || dicas pra pegar pro no volleyball legends #haikyuulegends #roblox #vbl #volleyballlegends || New Season 14 (New Update Volleyball Legends) #volleyballlegends #vbl #roblox #robloxfyp #viral || NUEVA UPDATE DE VOLLEYBALL LEGENDS!!!! #volleyballlegends #roblox #update || SuperDuperMonkeBros: NEW SEASON IN VOLLEYBALL LEGENDS! || 🔴SEASON 14 Volleyball Legends UPDATE Livestream || nerf encho in volleyball legends #shorts #roblox #volleyballlegends #trending #funny #anime #fyp || 🔥Rankeada Resetada🔥  Atualização do Vlb Legends,Shadow VBL || YBelaaaa || ItsCat || Shadow VBL || Laxea || thenicoplay22 || SuperDuperMonkeBros || Astellari || Vyra || Joakings,16
2640407187,(UPDATE!) Car Driving Indonesia,2026-04-11,12507,7822,59.89516747634877,CAR DRIVING INDONESIA - ROBLOX #liveshort #short #mediashareon || Pesona hilux faceswap|Roblox (Car driving Indonesia) #roblox #robloxindonesia || Karetka w Polish car driving #roblox || Pracuje w grze Polish car driving część 2 || JAKIE JEST AUTO W SMARDZEWIE NA PRZECENIE W POLISH CAR DRIVING 9 #pcd #shorts #roblox  #viral || 🔴WBIJAMY MILION NA PCD POLISH CAR DRIVING 🔴 || Pracuje w grze Polish car driving  || Test przyśpieszenia Poloneza 2.0 w Polish Car Driving ( Roblox ) || EGZAMINATOR MNIE NIE LUBI?! 😡 ROBLOX (POLISH CAR DRIVING) #10 || WYWIAD Z HOGATYM! | Hogaty odpowiada na pytania w Polish Car Driving! (Roblox),FerryFarhann || Christiaan.  || pilenar100 || MIKOL z WIELKOPOLSKI  || Czerwony gość || Karol5x || MIKOL z WIELKOPOLSKI  || Pixelowy Gracz || AK Games || Natii,26
8991105066,[🌴Summer] Idle Defense,2026-04-11,1968,976,101.63934426229508,TOWER DEFENSE TAPI BUKAN? LAH GIMANA TUH?! - Summon Heroes Roblox,SKINNY - D,1
5678284602,🏰 Block Tales [DEMO 5],2026-04-11,1996,1498,33.277703604806405,BE A LUCKY BLOCK LIVE!!🤪 Playing with subs!! 🤩 PART 197 || 🔥 SECRET LUCKY BLOCK 💸 Easter Update Chaos (16M/sec!) 🔥#roblox  #shortsvideo || BE A LUCKY BLOCK LIVE!!🤪 Playing with subs!! 🤩 PART 195 || AKU MINING LUCKY BLOCK DAN SEKALIAN IKUT ADMIN ABUSE?! | Roblox Break a Lucky Block || AKU MINING LUCKY BLOCK DAN SEKALIAN IKUT ADMIN ABUSE?! | Roblox Break a Lucky Block || Break a lucky block AA || BE A LUCKY BLOCK LIVE!!🤪 Playing with subs!! 🤩 PART 200 || BE A LUCKY BLOCK: THE CIRCUS EVENT! 🎟️ Unlocking Clownteo &amp; More Circus Brainrots! 🤯 LIVE EVENT || BE A LUCKY BLOCK LIVE!!🤪 Playing with subs!! 🤩 PART 201,Leonard Plays Roblox || Mercury Streamers || Leonard Plays Roblox || Max_Gaming || Max_Gaming || W____DarkNinja____W A27 || Leonard Plays Roblox ||  Gmod Hoppy Playground || Leonard Plays Roblox,9
9098570654,[UPD💎] 🧟 Survive the Apocalypse,2026-04-11,36658,24803,47.79865338870298,"Ok hari ini saya main survive the apocalypse di roblox || ROBLOX - SURVIVE THE APOCALYPSE || SURVIVING 99 DAYS IN THE APOCALYPSE! ☢️🥫#roblox || Stream Till I Die, Roblox Survive the Apocalypse Day 4 || like and comment if it works #gameplay #survivetheapocalypse #roblox || 🧟 Survive the Apocalypse - Roblox || Showcase Granade launcher survive the apocalypse #apocalypse #roblox #zombie #update #military || KITA COBA BERTAHAN DARI KAWANAN ZOMBIE | SURVIVE THE APOCALYPSE ROBLOX INDONESIA || ROBLOX SURVIVE THE APOCALYPSE MILITARY AREA UPDATE PT 2 !!! || DERROTAMOS al Nuevo Jefe Exterminador y conseguimos la MINIGUN en Sobrevive al Apocalipsis",JAY AIDEN PATRICK LOO KPM-Murid || Papi Hnaninif Gaming || Cosmic Frame Arcade || Ryurokami || Qwert || Bonga || enanopokestar || Kumayama Ryuu || onxy || Robi Blox,15
9802644580,Summon Heroes (Runes 🗿),2026-04-11,14161,4109,244.64589924555855,"Summon Heroes #Roblox #NEW || Summon Heroes || Ranger [Summon Heroes] || Thief [Summon Heroes] || Sage [Summon Heroes] || 👑 EMPEROR! 👑|⚔️SUMMON HEROES🎵| @yulyonroblox |🎮ROBLOX | 4K || 🌇 EMPEROR! 🌇|⚔️SUMMON HEROES🎵| @yulyonroblox |🎮ROBLOX | 4K || TOWER DEFENSE TAPI BUKAN? LAH GIMANA TUH?! - Summon Heroes Roblox || Roblox (Beating Summon Heroes - Rookie Island Stage 1,2,3) || 🔴 NOOB ➜ PRO LIVE! Summoning INSANE HEROES in Roblox Summon Heroes!",MarkyDaSharky || Capy Capy Channel || PhoebeKami || PhoebeKami || PhoebeKami || YulyOnRoblox || YulyOnRoblox || SKINNY - D || Laseman Live || DEBO MASTER,18
