universe_id,game_name,det_at,det_ccu,week_ago_ccu,growth_percent,video_titles,channels,n_videos
5750914919,Fisch ⚓ [CREWS],2026-05-03,74037,33513,120.92173186524633,"The Universal Tower Defense X Mini Update is Chillin my Nuts Off (It&#39;s a nice mini update) || Fisch update || Patriotic megalodon #fisch #roblox || map fisch #roblox #fisch #fypシ || WINGRIPPER&#39;S BROTHER, THE WINGKEEPER #fisch || *NEW* CASTBOUND ROD 60-SECOND GUIDE!! #roblox #fisch #robloxshorts #gaming #robloxmemes || GUIDE CARA DAPAT STEAMPUNK ROD DI ROBLOX FISCH || #fisch #roblox #viral #fypシ゚viral || FULL GUIDE To MUSIC VENUE TAKEOVER UPDATE In Fisch Roblox! || *NEW* Castbound Rod vs Bloop Fish! 🎣 #roblox #fisch",Balakay || Dr. GhostH👻 || Pinkify || ATR gaming || jeremayy || illucian || AndriaNoid || idk a name || Carbon Meister Plays || heaL,48
8220767002,[👽] Bee Garden,2026-05-03,26118,9402,177.79195915762605,Little Pressure on Zombies - Roblox Survive Zombie Arena || ROBLOX SURVIVE ZOMBIE ARENA!! #ZombieSurvival #GamingLive || Extra Flame Turrets - Roblox Survive Zombie Arena || Anime Guardians | Johnny Joestar Lv.150 con Trait Última – Showcase #roblox || พักการเอาตัวรอดสักหน่อยยย | Survive Zombie Arena |BoonVibe Gamer Ep.13 (Feat.CastDuii) || Roblox Survive Zombie Arena #shorts || Why are there so little Medics in Survive Zombie Arena🤔 #gaming #roblox || Demolitionist in Survive Zombie Arena is kinda OP?! || Survive Zombie Arena--I Almost Died!!! Necromancer Class--- || Survive Zombie Arena Roblox--Necromancer Class!! Is It Worth It??,Drew || RayanPlayz || Drew || Karantza  || BoonVibe || Yashj Blox  || GigaBlox || boxbuxx || cinnamonroll roblox || cinnamonroll roblox,62
7709344486,Steal a Brainrot,2026-05-03,235656,184481,27.740255094020522,TO DAY WE WILL PLAY ROLLERS FOR BRAINROT || GUGUGAGA Gets MAX SPEED in Kick a Lucky Block 🐧 Escape TSUNAMI! #roblox #robloxedit #brainrot || 1000X LUCK PURE OG STRAWBERRY ELEPHANT in Kick a Lucky Block #roblox #usa #shorts #brainrot || I Just Got a Golden Crazylone Pizaione🤫(Kick a Lucky Block) #roblox #rblx #brainrot || I Just Got a Golden Meowl🤫(Kick a Lucky Block) #roblox #rblx #brainrot || I Just Got a Golden Strawberry Elephant🤫(Kick a Lucky Block) #roblox #rblx #brainrot || Roblox roller skate for brainrots  || I Became RICHEST in ROLLERSKATE FOR BRAINROTS         Roblox || Roblox Roller skate for brainrot  || Roblox ROLLER SKATE For Brainrots    Yashj Play #shorts  #roblox,XXX_BACON_BROS || GuguGa Blox || RobloxSensentoy || IMNOTURBroutha || IMNOTURBroutha || IMNOTURBroutha || W or L boy  || Bloxyy || Aagman1346  || Yashj Play,18
9266873836,[QOL] Anime Fighting Simulator: Endless,2026-05-03,5595,4467,25.25184687709872,pet simulator 99,Zheka_play,1
4582358979,Arm Wrestle Simulator,2026-05-03,3883,2851,36.215363030515604,Pet simulator 99 da sizin yardiminizla Titanic aliorm gün 1❤️‍🩹 #roblox #invincible #ps99 #help || 🚀 Pet Simulator 99 | New Update  | WBIJAJ TERAZ! || 🚨 NEW Pet Simulator 99 FANTASY UPDATE LIVE + MASSIVE GIVEAWAYS (HUGES/DIAMONDS/TOKENS) || Pet Simulator 99 - Atlantis Minigame Speedrun (33.51 Sec) || 🚀 Pet Simulator 99 | New Update | WBIJAJ TERAZ! || Pet Simulator 99 - Jungle Obby Speedrun (51.42 Sec) || pet simulator 99 || Pet Simulator 99 FANTASY UPDATE | Giving away HUGES Viewers! || Pet Simulator 99 Fantasy World Update! (Roblox) || НОВОЕ ОБНОВЛЕНИЕ В TOWER DEFENSE SIMULATOR / ОБЗОР НОВОГО ОБНОВЛЕНИЯ В ТТД В РОБЛОКС,MiriCatir || GrzybekFN || Gamerzdude || AHdrifts || Lisia || AHdrifts || Zheka_play || oMinertjee || CrazyPlays   || FreeZPlay,10
1603160529,[VANTAVIRUS🔥] Outbreak ,2026-05-03,779,507,53.64891518737672,Best enchants to break boss chest in pet sim 99! #petsimulator #roblox || BREAKING MY FRIEND OUT OF JAIL ON BROOKHAVEN RP ROBLOX || Tactician Unbreakable Walls - Roblox Survive Zombie Arena,LPM AND VINCE gaming || IcyBlox || Drew,3
10050364824,[COLLAB] Trending Meme Animations,2026-05-04,2825,940,200.531914893617,V3.15 Update Information 🤯 #trend #memes #information #sneakpeek #emergency #hamburg #roblox #games,MilanEH🅥,1
2251388500,Twisted [BETA],2026-05-04,4772,3453,38.21314798725746,Sprout Gets Griefed By All The Twisteds In Dandys World New Update #roblox #dandysworld #update || Twisted Sprout Is Sad And Griefed By Sprout In Dandys World New Update #roblox #dandysworld #update || Catching the crystalised dragon in fisch#fisch#roblox#fyp || Types of Twisted Combos in Dandy&#39;s World PART 127 (Fan Suggestions) || O TWISTED NOS ACHOU! (DANDY&#39;S WORLD ROBLOX)💀@Roblox #dandysworld #roblox #robloxterror,DANDICUS || DANDICUS || Pumkingod || NatureNPlayz || Paola e Eliseu,5
5203828273,Dress To Impress⭐,2026-05-04,67894,51156,32.719524591445776,I Added A DTI Would YOU Rather TOWER! *OUTFIT Went WRONG* | ROBLOX Dress to Impress Challenge,callmehhaley,1
4983034985,Conquer The World WW2 [🎖️New Ranks ],2026-05-04,4083,2841,43.71700105596621,I Built MAX LEVEL Army to Conquer The WORLD in Roblox!,Quacks,1
6739698191,[CURE] Violence District,2026-05-04,30049,23760,26.468855218855218,Wheelie district ,Bentley Capwell,1
4864117649,untitled tag game,2026-05-04,1806,1408,28.267045454545453,Weird gun game,"carl,weird vid",1
10062649503,Would You Rather: Outfit Tower 💖,2026-05-04,19349,5401,258.2484725050917,ยิ่งกระโดดยิ่งได้แต่งตัวสวยหล่อแบบฟรี✨ | Roblox Would You Rather Outfit Tower2 || Would you rather tower! || Avatar Hilang Kepala! Would You Rather 😱👕 #roblox #funny #gaming || Would you rather . OUTFIT TOWER ||  Playing Would you rather outfit tower!! On Roblox  || Would You Rather… THIS?! 😳 Roblox Outfit Tower || I Added A DTI Would YOU Rather TOWER! *OUTFIT Went WRONG* | ROBLOX Dress to Impress Challenge || would you rather: outfit tower || เลือกประตูที่ต้องการ แล้วเป็นจริง !! ในแมพกระโดด 👚 Roblox Would You Rather Outfit Tower || Would You Rather Outfit Tower | Roblox Game | LHN Play,AVA GAME || ♡αժօթԵ _ოҽ★ || AUREL KAWAII || Marianne Casavant || Tina Nguyen 💗 || HIF 21 || callmehhaley || ClaraClaireBloxx || Foxie Jeff Plays || LHN Play,11
4053293514,FNAF: Eternal Nights 🍕,2026-05-04,3757,2591,45.021227325357,#arknights,Ethersblox,1
3240075297,Berry Avenue 🏠 RP,2026-05-05,21566,16837,28.08695135713013,POV: You&#39;re about to film a Roblox Berry Ave. RP (BTS),~𝕁𝕠𝕝 ℝ𝕠𝕓𝕝𝕠𝕩~,1
1001911915,[🌽] Farming and Friends,2026-05-05,1693,1011,67.50741839762611,dsi,Nederland RP,1
9584852943,[⚡] +1 Speed Keyboard Escape | Candy & Chocolate,2026-05-05,36633,25519,43.55186331752812,Roblox Live +1 Speed KeyBoard Escape | Candy &amp; Chocolate || +1 Speed Keyboard Escape | Candy &amp; Chocolate ! ROBLOX ! roblox #roblox #robloxshorts || 1 Speed Keyboard Escape Candy and Chocolate #gaming #roblox #bloxfurit #crazygame #minigames || [UPD] +1 Speed Keyboard Escape | Candy &amp; Chocolate || 1+ speed keyboard escape / candy &amp; chocolate . live game play  Roblox Funny Moments  day 11 || #roblox#Upd+1 speed Keyboard Escape l Candy &amp; Chocolate || LIVE | +1 Speed Keyboard Escape วิ่งทะลุคีย์บอร์ดสุดฟิน ⌨️ใครจะถึงเส้นชัยก่อน?,AbhiOP Extra || Ak47 BLOX || Sonu Gamer || AndyNguyenFan || Zyvex Gaming || SaimGaming2018 || PackKooGaming,7
9765324104,[🏍️] Wheelie District,2026-05-05,6017,2047,193.87057387057388,"Wheelie district  || PLAYING WHEELIE DISTRICT WITH MY BROTHER IF U WANT MORE VIDEOS WITH MY BROTHER GET THIS VIDEO 50LIKE || Wheelie District Roblox How I Got Sport Vehicles by doing AFK Farm || wheelie district || WHEELIE DISTRICT GUIDE! (How To Get Cash, AFK Farm, Best Bikes, &amp; SECRETS) Roblox || wheelie district #roblox #surron #gaming #ebike || Game name is Wheelie District #roblox #robloxedit #edit #bikegame #bikeedits || wheelie district",Bentley Capwell || LaysWarriorr || Ricoko || red black centipede  || ItsChalls || Nice || Sr7 || red black centipede ,8
2936053166,[🦑] Squid Game X,2026-05-05,9621,7631,26.065450257149408,Impossible Squid Game Glass Bridge 2 ! ROBLOX ! #roblox #robloxshorts #gaming #shorts,Ak47 BLOX,1
7488190691,[🐉UNIVERSAL FEST P2🐉] Universal Tower Defense X,2026-05-05,46875,29266,60.17050502289346,[Universal Tower Defense X] นั่งทำประจำวัน + พูดคุยอัปเดต 3!!? l EP:7 || 🔴LIVE เปิดใจเล่นครั้งแรก : Universal Tower Defense X || ГАЙД НА ФАРМ ВСЕХ РЕСОВ В UNIVERSAL TOWER DEFENSE X + САМЫЙ ЛУЧШИЙ СПОСОБ + ГАЙД НА МАКРОС || Best META Teams for 2.75 Update in Universal Tower Defense! || Official 2.75 Tier List in Universal Tower Defense X! (GOJO Won) || How to get Sukuna - Boundless | Universal Tower Defense X || แนะนำวิธี AFK ประตูนารูโตะ!!? l Universal Tower Defense X #roblox #utd #universaltowerdefense || แนะนำวิธี AFK ประตูนารูโตะหาแต้มหารีโรล!!? l Universal Tower Defense X || Roblox | Universal tower defense X โชว์เคสตัวละครเวอจิล สอนเล่นให้ตีรัวๆแบบไม่ติดอนิเมชั่น || Universal Tower Defense X Team Building Guide For The BEST TEAM &amp; UNITS!!! (Roblox),อุด้งร้อนมาก || NICESLASHz || BUDDHA  || Tuki || Tuki || Klezmer || อุด้งร้อนมาก || อุด้งร้อนมาก || Gamezamini || DomiBlox,70
10016841656,Noob Tower Defense [📖Index!],2026-05-05,7515,3830,96.22715404699738,[Universal Tower Defense X] นั่งทำประจำวัน + พูดคุยอัปเดต 3!!? l EP:7 || 🔴LIVE เปิดใจเล่นครั้งแรก : Universal Tower Defense X || ГАЙД НА ФАРМ ВСЕХ РЕСОВ В UNIVERSAL TOWER DEFENSE X + САМЫЙ ЛУЧШИЙ СПОСОБ + ГАЙД НА МАКРОС || Best META Teams for 2.75 Update in Universal Tower Defense! || Official 2.75 Tier List in Universal Tower Defense X! (GOJO Won) || How to get Sukuna - Boundless | Universal Tower Defense X || แนะนำวิธี AFK ประตูนารูโตะ!!? l Universal Tower Defense X #roblox #utd #universaltowerdefense || แนะนำวิธี AFK ประตูนารูโตะหาแต้มหารีโรล!!? l Universal Tower Defense X || Roblox | Universal tower defense X โชว์เคสตัวละครเวอจิล สอนเล่นให้ตีรัวๆแบบไม่ติดอนิเมชั่น || Universal Tower Defense X Team Building Guide For The BEST TEAM &amp; UNITS!!! (Roblox),อุด้งร้อนมาก || NICESLASHz || BUDDHA  || Tuki || Tuki || Klezmer || อุด้งร้อนมาก || อุด้งร้อนมาก || Gamezamini || DomiBlox,86
10010371086,[EMPEROR] Invincible Edit Test,2026-05-05,1192,585,103.84615384615385,Invincible in jujutsu shenanigans #roblox #jujutsushenanigans,heightgamin5,1
8181391950,[UPD] Neo Tennis,2026-05-06,2152,1140,88.7719298245614,Ich spiele Toilet Tower Defense OG Teil 2 || No tiene....  #forsaken #roblox || Mini War in Gulf? US-Iran Tensions Explode After Project Freedom Launch - Scott Ritter,Peat Master || The tricy663 || Scott Ritter Updates,3
2682938349,Wild Horse Islands,2026-05-06,2613,2053,27.30150998538724,dsi,Nederland RP,1
1526814825,[UGV] War Tycoon,2026-05-06,6874,5420,26.83579335793358,Dandy’s world toons irl part 2 😱😱👀 #roblox #dandysworld #dandysworldroblox #shorts  || A mini update JUST dropped in War Tycoon || #roblox #subscribe #clone #kingdom #tycoon,shadowmiles || Great GARBANZO || HBDG,3
8473646150,Power Simulator X,2026-05-06,2402,1355,77.30627306273063,🌈(EVERYTHING FREE?) Slime RNG MODDED | LINK IN DESC! #slimerng #roblox #petsimulatorx #gaming #sab || 🌈(EVERYTHING FREE?) Slime RNG MODDED | LINK IN DESC! #slimerng #roblox #gaming #petsimulatorx #sab,tiwikscxn || Moon Games,2
4293374620,[🏆⚽] FIFA Super Soccer,2026-05-06,10442,3138,232.75971956660294,Playing Roblox FIFA Super Soccer || DUO WITH @mrcoopeth  😎  | FIFA Super Soccer || Playing fifa super soccer with a loss || STOP playing monkey in the middle| fifa super soccer || [#22] Raid: Shadow Legends + Roblox | FIFA Super Soccer - Super League Soccer || The autowalls 💀 | Football Super Soccer | Roblox || Fifa Super Soccer | i became Gianluigi Buffon in FSS or SLS || IGRAMO FIFA SUPER SOCCER!! || FIFA SUPER SOCCER!! || in fifa super soccer 🔥⚽,BRTRIBE || Justdeony || Rayaan || Pinkykate14 || Am1arow || Mr. Paulus12 || Doodle Arkey  || BALKANSKI GAMERI || linkboy || soccerheroff,17
6022371481,[🌷] Spelling Bee,2026-05-06,478,327,46.17737003058104,Telling AI to make Dandy&#39;s world characters PT.1,BunnyWabbit809,1
9792947201,Slime RNG,2026-05-06,120783,29890,304.0916694546671,🔴LIVE🔴AFK ON SLIME RNG || Best Slime RNG MODDED | LINK IN DESC! (FREE GAMEPASS!?)🔥🌈 || Best Slime RNG MODDED | LINK IN DESC! (FREE GAMEPASS!?)🔥🌈 || Best Slime RNG MODDED | LINK IN DESC! (FREE GAMEPASS!?)🔥🌈 || Best Slime RNG MODDED | LINK IN DESC! (FREE GAMEPASS!?)🔥🌈 || I had the RAREST slime.. for 2 hours | Slime RNG || LAST CHANCE GIVEAWAY! 🎁 SLIME RNG (Roblox) #slimerng #roblox #robloxgames || Starting Over as NOOB with OP SECRET in Slime RNG! (Roblox) || 🔴Slime RNG Rebirth 17??🔴Roblox Live Stream || J’ai TRYHARD ce jeu de SLIME RNG… EST CE QUE J’AI EU UN LÉGENDAIRE ? 😱,JaiZee || tiwikscxn || tiwikscxn || Moon Games || Moon Games || Kyisue || Blayv || CurryBlox || SkyTheEye || DON Landers,83
8719555347,[🏠TINY HOMES] Southern Mudding 🚜 OffRoading,2026-05-06,10340,7366,40.374694542492534,Did Southern Mudding ACTUALLY Copy American Plains Mudding? (ROBLOX) || Delivering A COMBINE HARVESTER In ROBLOX Southern Mudding! (RP),LiamPlays || AmazeGames,2
6945584306,[UPD] Azure Latch,2026-05-06,3989,2885,38.26689774696707,Forsaken AZURE update all leaks/sneak peaks so far! #forsaken || Azure update!!! #roblox #forsaken #forsakenroblox || AZURE &amp; TWO TIME LMS TEASED In Roblox Forsaken... #new #roblox #forsaken || el nuevo tema de persecución/lms de azure #roblox #forsaken #azure la azure update se Aserca👀👀 || TODAS AS NOTÍCIAS RECENTES SOBRE o FORSAKEN (AZURE UPDATE) | ROBLOX,ElitePlaysRBLX || Moonlightfv || sprag || undrakobloxxercualquiera || LuanBlox,5
10013145287,Giant Bug Zoo 🐞,2026-05-06,945,570,65.87719298245615,Giant Gold Star Barbell Kick a Lucky Block #roblox,YDBP Plays Games,1
9348272796,[UPD] Survive Zombie Arena,2026-05-06,35966,26385,36.31161054366982,new bug in survive zombie arena || NEW BASTION CLASS SURVIVE ZOMBIE ARENA ROBLOX LIVE!! #SURVIVEZOMBIE #VIRAL || Little Kick to It - Roblox Survive Zombie Arena || survive zombie arena || Laser Turret Spot - Roblox Survive Zombie Arena || Starter Laser Turret - Roblox Survive Zombie Arena || Minigun Moment - Roblox Survive Zombie Arena || necromancer (survive zombie arena) #fypシ #roblox #survivezombiearena #robloxshorts #fypシ゚viral || Expensive Turrets - Roblox Survive Zombie Arena || Necromancer Testing Graphics Card - Roblox Survive Zombie Arena,pedals & pixels || RayanPlayz || Drew || BIELZIN || Drew || Drew || Drew || FoxTheFoxxy || Drew || Drew,19
6760085372,[🩸BLOOD V2] Jujutsu: Zero,2026-05-06,3748,2941,27.434982151963283,Testing out the switcher moveset in jujutsu shenanigans Roblox gameplay || Jujutsu Shenanigans #roblox #shorts || 3 More Things YOU Didn&#39;t Know About JJS | Jujutsu Shenanigans #roblox #jjkgame #jjkseason3 #jjs #fyp || Viltrum&#39;s Emperor W.I P || Jujutsu Shenanigans || ATUALIZAÇÃO v1.76 NO JUJUTSU SHENANIGANS? PERSONAGENS DO WORKSHOP QUE PODEM APARECER! || jogando jujutsu shenanigans com personagem aleatório parte 2 || spidy tries beam clashing in jujutsu shenanigans. 🫠#jjs #spidy #jjk #roblox #cool beam clash! || Ai Ruins Jujutsu Shenanigans || I Found Something Creepy in Jujutsu Shenanigans 😳 || Jujutsu Shenanigans MECHAMARU/PUPPET MASTER PvP games || Roblox,"GA_B || SouL11 || Dr,goose || Ruth || Hug0 || Pixel Man || Goldenisold || Sync || MCZXYN || qrinz",42
8015734617,Steal Brainrots Trading Plaza 🛒,2026-05-06,1639,1051,55.94671741198858,STEAL A BRAINROT UPDATE || STEAL A BRAINROT TRADING / LIVE WITH VIEWERS || 🔴 ROBLOX LIVE | STEAL A BRAINROT | TRADING USING NEW MACHINE! #roblox #shorts #stealabrainrot || 🔴LIVE NOW: INSANE Trading &amp; Duel in Steal a Brainrot | #stealabrainrot #sabtrading || 🔴LIVE Steal A Brainrot trading 🔴#stealabrainrot #live || Roblox Steal A Brainrot Admin Abuse (Taco Tuesday) || Steal a Brainrot live Trading {DUPING BRAINROTS},VexVant || OUTCAST GAMER MONSIVA || Anthonytheplayer || GOJO || zento || FaZmash || YbgOfficiallBloxStudios,7
10034440925,Shells,2026-05-07,1743,508,243.20866141732282,shelly gets jealous because nobody heals her #roblox #dandysworld #shorts || shedletsky dies 💔  #roblox #forsaken #ultra #gacha,LooeyBlox || JGMM,2
7128251171,Superstar Baseball,2026-05-07,8463,2058,311.2244897959184, Trying not to get picked and superstar baseball!!! || Big mouth vs big tongue! - Mario Superstar Baseball - MattGree vs Baltor - The Rivalry || Best homeruns in Superstar Baseball! #roblox #shorts #homerun #dingers #baseball #superstar || MARIO SUPERSTAR BASEBALL ⚾️ | BIRDO CANT HANDLE PEACH 🤭🍑| 2-PLAYER | Nintendo GameCube || Superstar Baseball || Me playing superstar baseball ,BK Broz || MattGree || KillstreakPlays || WaluigisGameVault || laceyg0602 || King SpongeBob15,6
10015834582,[🌸] Nuke for Brainrot,2026-05-07,16083,5497,192.57776969255957,kick a lucky block #roblox #robloxshorts #robloxedit #escapetsunamiforbrainrots #brainrot || CHUTE UMA LUCKY BLOCK PARA BRAINROTS #roblox || Kick a Lucky Block in Escape Tsunami for Brainrots 🦶📦🌊 || Kick lucky block for brainrot #roblox || 😱⚽️KICK A LUCKY BLOCK FOR BRAINROT🔥✅ #roblox #shorts || I opened 10 INFINITY LUCKY BLOCK  in Escape Tsunami For Brainrot Roblox!,KILLER BEAM || Jose Gamer || Robloxzado || KUROO || RobloxDaily || Dawn Blox,6
9526307912,[🐒] Escape The ZOO!,2026-05-07,9230,6431,43.523557767065775,+1 Speed keyboard Escape Chocolate as Candy #gamingvideo || ESCAPE THE KEYBOARD in +1 Speed Keyboard Escape (Roblox),HiyaGamer47 || Tofuu,2
7787359931,Kingdom World,2026-05-07,9313,5051,84.36108086706918,2 hidden place in kingdom of rose #bloxfurit #roblox,RisanGaming34 ,1
9948670918,[🚀] Launch!,2026-05-08,538,388,38.659793814432994,Douglas Mecgroger: Mini War in Gulf US Iran Tensions Explode After Project Freedom Launch,The Current of Douglas Macgregor,1
578392296,ABA,2026-05-08,9179,5581,64.46295798620443,"Bagi Bagi Brainrot OG buat yang udah main 1 hari, Bisakah Celestial? | Kick a lucky Block Roblox || Bagi Bagi Brainrot OG buat yang udah main 1 hari | Kick a lucky Block Roblox #shorts || BASTION MAX UPGRADE SHOWCASE in Survive Zombie Arena! Roblox || bastion class is too op || Mabar dan belajar main VD (Violence District) Bootleg DBD Dead By Daylight",ADT Gaming || ADT Gaming || ItzVexo || kilicoolpro || Marinska dez,5
6594435384,SpongeBob Tower Defense🍍,2026-05-08,16141,3310,387.64350453172204,toilet tower defense || Toilet Tower Defense: LIVE || Граю в Toilet Tower Defense || Playing nightmare mode using units from episode 79 part 2 (Corrupted Crate) in Toilet Tower Defense || Tôi có chút rương trong toilet tower defense #roblox #bloxfruits #huu2228 #games #toilettowerdefense || OG TOILET TOWER DEFENSE IS BACK And Its The Same The Day It Left || Playing TTDS!!!(Toilet Tower Defense) || ONLY USING EXCLUSIVE UNITS IN TOILET TOWER DEFENSE || Toilet tower defense admin and owner || Test uts làm lại trong (blocky toilet tower defense),gaming mine09 || Jonnigameplay || PahaOFF || Azam dan Azzahra the Series Story || Huusamurai2228 || Bking || Chance Is Fun || Jarkin_bloxYT || Neptune_planet || blue_dummy,54
10078476822,Would You Rather: Style Towers 💞✨,2026-05-09,6462,3080,109.82142857142858,Would you do this trade?  #funny #adoptme #roblox #fyp,Viv and Ava,1
4778845442,[LEGACY] Toilet Tower Defense,2026-05-09,19862,15865,25.191850112667623,Toilet tower defense a regresado a su prime || how are u doing ? btw game is toilet Tower defense || TTD INV TOUR TOILET TOWER DEFENSE LEGACY UPDATE RICH #roblox #ttd #skibidi #viral #tuff || ТТД ВЕРНУЛСЯ ! Toilet Tower Defense || #toilet tower defense || Nothing to UTC in toilet tower defense (roblox) Part 1 || toilet tower defense c cocos490052 || Toilet tower defense || Old Blocky Toilet Tower Defense game made by @arizonathedeveloper || •Live | มาเล่นเเมพเก่าที่คุ้นเคย (วันนี้มาเเปปเดี่ยว)   | Toilet Tower Defense,Chef TV Men || kitty king official  || SABTRADER2006 || The Frisonics || russian hamster  || Jace || Чип || carim || neo metal sonic  || ShiraoriCH,58
4723764956,🎥My Movie,2026-05-09,13027,10227,27.372280615986313,Dacoit movie ott release date adivi sesh mrunal thakur,ST cinema updates,1
79301772,🔨Plane Crazy🔨 [UPDATE],2026-05-09,4960,3941,25.856381629028164,500x LUCK WAS CRAZY,Blam Sponge,1
371263894,Greenville,2026-05-09,6704,5141,30.402645399727678,Trend Violence district roblox #robloxedit #roblox #violencedistrict #fyp #fypシ #robloxshorts,orangimut,1
9837612476,[UPD] Mini War,2026-05-09,30906,13842,123.27253025103846,Mini Update 11 showcase || Strange Bathub War || roblox ||#bringboomback || Grinding mini war in roblox || Minik ORDU Kurup Ülkemi Korudum 😝 - Roblox Mini War || I bought MILLIONS of Soldiers to Build the BIGGEST Army in Roblox MINI WAR! || Playing game called mini war #roblox  || Roblox Mini War Jadi Perwira Terkuat | Roblox Indonesia || main mini war di Roblox || Khi tôi nghĩ mình là main chính trong Mini War… #roblox #robloxvn #miniwar #robloxminiwar #robloxfun || PERANG!! Aku Bangun NEGARA SUPER KUAT Dan KUASAI DUNIA DI ROBLOX!!😏- Mini War Roblox || STRONG 1000%!! Bangun Markas MILITER Indonesia Terhebat &amp; Bomber Terkuat 🥶🔥🥶 | Mini War Indonesia,chicken_nuggets || Roblox_gamerrr || Babi Oyunda || BUDDY || RobloxBrookhavenDavid Reborn  || KangYuu31 || JANUAR MUHAMAD ZHAKY || Rion Hà || TomElSigma || HaYoGo,34
9564673841,Monkey Bomb Tag,2026-05-09,24228,13446,80.18443461123712,monkey escape,Rabity Unicorny!,1
7436755782,[🔥] Grow a Garden 🌶️,2026-05-10,157694,102287,54.16817386373635,"THE BEE UPDATE GOT DELAYED AGAIN IN GROW A GARDEN  #growagarden || 🐝THE FINAL LEAKS of BIZZY BEE UPDATE is NOW HERE! NEW HONEY GARDEN, ETC! 🔥 (Roblox Grow a Garden) || GROW A GARDEN LIVE PREAPARING FOR BIZZY BEE UPDATE!!!!!!!!!! || Bocoran Bizzy Bee Update Grow a Garden || THE BEE UPDATE IS RELEASED TOMORROW IN GROW A GARDEN! || 😍 EVERYTHING COMING &quot;ALL LEAKS&quot; THIS BIZZY BEES UPDATE IN GROW A GARDEN || HONEY HIVE SEED PACK 🍯 BOCORAN SEED PACK BARU BIZZY BEE EVENT 🐝 - GROW A GARDEN 🌳 #roblox || jam update bizzy bee event 2026 diundur 30 menit, pls like and subs dan komen, #growagarden #fyp || HOW MUCH HONEY DO YOU HAVE? 😎😎 #growagarden #roblox #shorts || This SECRET BEE EGG is INSANE in Grow a Garden BIZZY BEE Update!",milon || PogiDominicYT  || koaw || Jefferson Ligarobloxid || jjaiirus || Sinister || Hayuledet || TZ_RAHMAT GAMING || AgentRoblx || Numerous,111
6749060816,Asylum Life 🔊,2026-05-10,10204,7969,28.038145429449777,My Brookhaven RP Roblox Avatar vs Me in real life,RalphAsherTheAviationKiddo,1
7996365376,[🌴] SHARP,2026-05-10,10094,7252,39.179593243709064,LIVE VIOLENCE DISTRICT?! KATA ORANG ORANG SERU!! - Roblox #roblox #roadto2k #mediashareon || Bertahan Hidup Bareng Viewers! Survive The Apocalypse #mediashareon #survivetheapocalypse #roblox || How To Get *INSANE* Rerolls &amp; Memoria Shards In Anime Vanguards Update 12.5! || Happy Mother’s Day my friends! We love you! #adoptmeroblox #adoptme #roblox || ⚠️ADOPT ME NEW SECRET PETS UPDATE!😱🔥MANY THINGS CHANGED! (EVERYONES HAPPY!) ROBLOX,MorTezz || Juvendy Indra || AB Plays || KatxGhost ౨ৎ || Striker180x,5
5578556129,Anime Vanguards: Godly Ascension,2026-05-10,66815,12418,438.0536318247705,ANIME VANGUARDS UPDATE 12.5 IS PEAK! EASY 2.5 MIL FLOWER METHOD - GET MADARA FAST! || HOW TO SPEEDRUN MADARA IN ANIME VANGUARDS || 🔴LIVE - Anime Vanguards UPDATE 12.5 MADARA Update Grind With Fans! || Getting Ice Queen Memoria in Anime Vanguards || NOVAS UNITS E MADARA VANGUARD! ESSA É A NOVA UPDATE DO ANIME VANGUARDS NO ROBLOX || I Obtained The 0.005% Vanguard Madara Unit In Roblox Anime Vanguards || How To FARM OVER 500K Flowers An HOUR! | Anime Vanguards (Roblox) || The *FASTEST* Method To Get Madara IN Under 4 Hours In Anime Vanguards Update 12.5! || [LIVE] 🔴 UPDATE 12.5 IS TODAY!!!! | Anime Vanguards! || FASTEST METHOD TO FARM MADARA IN AV | ANIME VANGUARDS  #animevanguards #roblox #games,JBax || janky || AB Plays || SoulYT || Nizuno_TW || Plaxcore || Paradox || AB Plays || MagicHavoc || ruberduckiez,55
