universe_id,game_name,det_at,det_ccu,week_ago_ccu,growth_percent,video_titles,channels,n_videos
5166944221,[UPD] Death Ball,2026-02-08,15930,12134,31.283995384868962,RIESEN UPDATE bald in NOTRUF HAMBURG | UPDATE NEWS | ROBLOX Deutsch || NEW VALENTINE&#39;S DAY UPDATE! All New Steal A Brainrot Characters vs Italian Brainrot || you vs Homer clip #roblox #death #robloxmemes #robloxedit #butifyoucloseyoureyes #youvshomer,Gamingarea || BRAINI || c00lkidd,3
6749060816,Asylum Life 🔊,2026-02-08,8700,5522,57.55161173487867,Real Life Corrupted Chest in 99 Nights in The Forest | Base on,NBlox,1
3808223175,[⚖️JUDGEMAN] Jujutsu Infinite,2026-02-08,31489,24399,29.0585679740973,Jujutsu Shenanigans Events Night!! Come Join! || Jujutsu Shenanigans is pure chaos||Roblox(devil hunter clip included) || Jujutsu Shenanigans | Naoya Army #shorts #roblox #jujutsushenanigans  || JUJUTSU SHENANIGANS #roblox #memes  #jujutsukaisen  #jujutsushenanigans  #robloxshorts #atualização || Jujutsu Shenanigans| ROBLOX | Naoya Zenin Edit⚡️🔥 #shorts #roblox #jujutsushenanigans #edit,rennzy X || OnlyKaos Gaming || Izaac5415 || S4toru || BraxxyRBLX,5
9498205054,[VALENTINE] Collect all Brainrots,2026-02-08,622,95,554.7368421052631,Plants vs brainrots  || plants vs brainrots || I Destroyed All Brainrots!!😈🌻(Plants VS Brainrots ASMR) || New valentines update in steal a Brainrot || My LUCKIEST Admin Abuse EVER in Steal a Brainrot! || 🔴20x LUCK HEUTE in STEAL a BRAINROT! || 🔴VALENTINE’S UPDATE URIAȘ + Lucky Block NOU în Steal a Brainrot! || VALENTINES UPDATE in Steal a Brainrot! || ADMIN ABUSE &amp; NEW VALENTINES UPDATE LIVE (Steal a Brainrot) || Ne jucam Break a Lucky Block( Update) + Facem tradeuri pe steal a brainrot,diamond dasher || Bloodman599 || clownfish456 || Mr Tyler Gaming || Nicks Blox || Standart Skill || Simplistu Gaming || NicoBlox || MrCatPlays || Ovidiu-Alexandru Dragota,16
1393178180,[Spring🌻] Polish Car Driving,2026-02-08,3959,115,3342.6086956521735,Czy youtuber z pcd odejdzie? (Polish car driving) #pcd #roblox #youtuber #odejdzie || Zostałem KIEROWCĄ UBERA PRZEZ 50H na Polskiej Wsi... (Roblox Polish Car Driving) || ZARABIANIE PIENIĘDZY W POLISH CAR DRIVING!! | 🔴STREAM🔴| || Polish car driving crazy truck driver #Youtube #Roblox #Pcd #funny #truck #youtubeshorts #crash || Polish Car Driving || Gram w Polish car driving  || Pociągi w grze Polish Car Driving || roblox odcinek 22  pcd (Polish Car Driving) 7 || Testuje nową aktualizacje na śmieciarkach w Polish Car Driving na roblox || Gram w Polish car driving na ROBLOX !,"INFORMACJE PCD || Jawor, ale GRY || KubixX || Eirinas || Ciborek || OLO_537 || Pociągi w Wielkopolsce i nie tylko || OLIGAMES_33 || Truck Driver Poland || Kubix",19
1312971993,✨ Saber Simulator,2026-02-08,2598,1847,40.66053059014618,BREAK A LUCKY BLOCK SIMULATOR IN ROBLOX  || #shorts Admin Event 🦀 + Duels PvP + Update in Tap Simulator und Steal a Brainrot 😍 || Admin Event 🦀 + Duels PvP + Update in Tap Simulator und Steal a Brainrot 😍,S G Coin || Jugger || Jugger,3
6325068386,[❄️ HIORI] Blue Lock: Rivals,2026-02-08,26226,20010,31.064467766116945,#roblox #gaming # blue lock # rivals || 🟢Blue Lock Rivals Update!│#600 SUB GRIND JOIN UP│ADMIN ABUSE│PULLUP ADD ME OWENROCKS2008🔵 || Blue Lock Rivals (BLR) Admin Abuse Event || ⌊BLUE LOCK: RIVALS!⌉ 𖣐👅𖣐 ⌊REWORK DO DESTRUIDOR!⌋ ⚽🥅 ⌊Mostrando o REWORK do RIN ao VIVO|LIVE⌋ || #bluelock #roblox #music #gaming || How To Obtain NEL Bachira in Roblox Blue Lock: Rivals! #bluelock #roblox #viral || Blue lock rivals is so fun || Blue lock edits #Shorts # blue lock rivals || EKREM’İ KIŞKIRTTIK… 10 SANİYEDE TİLT OLDU  | Blue Lock Rivals || POV: PEAK HITBOX MOMENT IN BLR💀🥀 #bluelockrivals #roblox #bluelockroblox #robloxshorts #fyp,@SJ__GAMER || FadoFusion || Onyx Blaize || PLAYTIME || H4X RIVALS || Official_Blueberry || Rptheplushanfrobloxtubetr12 || Saadan edits || DaisukeBF || ChefioBloxian,14
4165164803,Clip It 😂🎬👗,2026-02-08,19836,8130,143.98523985239854,new clip new update 🥰🥰 || last clip was lag#shortsfeed #roblox #rblx || I Upgraded Brainrots Using SECRET RECIPES in Escape Tsunami For Brainrots || Jujutsu Shenanigans is pure chaos||Roblox(devil hunter clip included) || How To Make All 322 Recipes in Craft Anime Roblox (Lowest to Highest Earn Rate Order) || #cgsong #liriklagu #yosho #trends #trending #viral #clips #trickshots #edit #funk #gaming #viralclip || LAST CLIP IS WORTH WATCHING!!!🤩 #roblox #robloxshorts #robloxrivals || you vs Homer clip #roblox #death #robloxmemes #robloxedit #butifyoucloseyoureyes #youvshomer || My clip #roblox #pleasesubscribe || Just a mid clip #roblox #rivals #shorts,sharif  meraj 72 || LilCoco Bean || Vindooly || OnlyKaos Gaming || VjolaBacon || McWorker240 || NAME || c00lkidd || JonathanVR || Noob2Pro,40
9484779066,[⚡] Steal From Brainrots 🤫,2026-02-08,71800,14553,393.3690647976362,I Destroyed All Brainrots!!😈🌻(Plants VS Brainrots ASMR) || Сбегите от цунами ради мозгов | Escape Tsunami For Brainrots  #roblox #shorts #brainrot #fixgame || Trading my plants vs brainrots for steal a brainrot! #stealabrainrot #roblox #shorts #fyp || roblox escape tsunami steal brainrot live || New LEADERBOARD in Escape Tsunami For Brainrots! || SAMMY Needs a Major Update Escape Tsunami Steal A Brainrot #shorts #stealabrainrot  #roblox || Escape tsunami for brainrots update || NEW ATM DUPE METHOD in Escape Tsunami for Brainrots #roblox #robloxgame #shorts #viral || NEW UPDATE ADMIN ABUSE in Roblox Escape Tsunami For BRAINROTS || Escape Tsunami For Brainrots! UPDATE &amp; ADMIN ABUSE !! #roblox #gameplay #livestream,clownfish456 || FixGame - Роблокс || EggPlayz || Bro Slays || ceroblox || LabBrain || Xaviplays  || GINGERMAN || Tehri313 || Awvexel Roblox,95
5578556129,Anime Vanguards: Godly Ascension,2026-02-08,83920,31661,165.05795773980608,"anime vanguards Igros 🔥 || Anime Vanguards tem os MELHORES efeitos do Roblox  #roblox || How To Get Extra Unit Storage In Anime Vanguards (Roblox) || ABOUT NEW UPDATE ANIME VANGUARDS!! || Monarch Broly Is The BEST DPS Unit With The New VANGUARD Memoria! | Anime Vanguards || This Team Clears EVERYTHING! (Anime Vanguards) || Hakka no Togame... Showcase da Rukia e da Erza no Anime Vanguards  || NEW UPDATE, NEW CID RAID VIDEO Sasuke Speedrun &amp; Number Skip Versions in ANIME VANGUARDS UPDATE 10.5 || |Anime Vanguards| o melhor Farm afk do evento de winter utilizando o ugphone  || Top 6 *MUST* Have Units In NEW Anime Vanguards Update 10.5!",Kevin Doguinho  || TkTakezo || MineBlox || MeRittsu2 || TrueShinobi || ranran || Akira || Salvation || conezão || AB Plays,64
9384605736,[☀️] Knockout! 🐧,2026-02-08,108506,40580,167.38787580088714,"Dinos can’t be my broguin #roblox #anklebreakers #funny #penguin #knockout #memes || THIS NEW KNOCKOUT UPDATE IS INSANE #knockout #roblox || Knockout&#39;s Biggest Update Yet! + Knockout Gameplay! || Broguins doing too much  KNOCKOUT!  #roblox #knockout #shorts || My armor couldn’t handle the water #knockout #roblox #cookies || roblox knockout #roblox #memes #shorts || new update in knockout, the bubblegum map at the end. || The Best Penguin in Penguin Knockout #roblox #penguinknockout || Mencoba bermain game Knockout! #roblox#shorts#knockout || Mapa Diferenciado! Knockout #roblox #knockout #shortsfeed #viralshorts",Singularity Shorts || Kermiez || ItsYaBoyCJ || BobAi || Cooke&Cream || TheWhiteVan123 || penguino || BreadBlox || G00DB0Y || DRAXSK BR,75
6035872082,RIVALS,2026-02-08,386277,303177,27.409730949247468,RIVALS AND PLANTS VS BRAINROTS GIVEAWAY!!! #roblox #rivals #plantsvsbrainrots #giveaway || #roblox #gaming # blue lock # rivals || 🟢Blue Lock Rivals Update!│#600 SUB GRIND JOIN UP│ADMIN ABUSE│PULLUP ADD ME OWENROCKS2008🔵 || Blue Lock Rivals (BLR) Admin Abuse Event || ⌊BLUE LOCK: RIVALS!⌉ 𖣐👅𖣐 ⌊REWORK DO DESTRUIDOR!⌋ ⚽🥅 ⌊Mostrando o REWORK do RIN ao VIVO|LIVE⌋ || How To Obtain NEL Bachira in Roblox Blue Lock: Rivals! #bluelock #roblox #viral || Blue lock rivals is so fun || Blue lock edits #Shorts # blue lock rivals || EKREM’İ KIŞKIRTTIK… 10 SANİYEDE TİLT OLDU  | Blue Lock Rivals || POV: PEAK HITBOX MOMENT IN BLR💀🥀 #bluelockrivals #roblox #bluelockroblox #robloxshorts #fyp,Starryastro || @SJ__GAMER || FadoFusion || Onyx Blaize || PLAYTIME || Official_Blueberry || Rptheplushanfrobloxtubetr12 || Saadan edits || DaisukeBF || ChefioBloxian,37
4938220315,[YOURSELF TOWER] Skibi Defense,2026-02-08,2746,1610,70.55900621118012,SpongeBob tower defense || Me playing SpongeBob Tower Defense  || Gambling in Spongebob tower defense! || #spongebob #towerdefense,Anyone wanna trade || King kj || Tspider37  || pokegod,4
5966671374,[❤️VALENTINES] SPIKED,2026-02-08,255,186,37.096774193548384,SIENDO FEMBOII 😱 #robloxshorts #roblox #mm2 #murdermystery2 #humor #murdermystery #robloxgames,DAN,1
4983034985,Conquer The World WW2 [🎖️New Ranks ],2026-02-08,8543,3675,132.4625850340136,Conquering The New Winter Update In Anime Vanguards (Roblox),Kage,1
2073329983,NEW MAP & BIKE🏍️ | Realistic Car Driving™,2026-02-08,4306,2031,112.0137863121615,NEW MAPS + SEASON 1 In Knockout! (ROBLOX) || Polish Car Driving || Gram w Polish car driving  || new map in Knockout #roblox || Polish Car Driving || Polish Car Driving  1,CeeJay || Ciborek || OLO_537 || MyloBloxx19 || FIBAK_25 || OLIGAMES_33PCD,6
5750914919,Fisch ⚓ [CREWS],2026-02-08,82250,62462,31.680061477378246,ZWEIT ACCOUNT WIRD REICH in NOTRUF HAMBURG | ROBLOX Deutsch || Ich werde von einem Polizisten GEJAGT! (Notruf Hamburg) || 🔴[Live] Road To 50K Subscriber 🗿 Escape Tsunami Brainrots #shorts #roblox #fishit #shortvideo #live || 99 Nights in the Forest Roblox Escape tsunami for brainrots! Fish it gameplay || Best my fishing brainrots pull? #viral #music #viralmusic #roblox #viralvideo #fyp #fypシ #funny || I became the RICHEST player on My Fishing Brainrots! || Today is a perfect admin abuse in my fishing brainrots!😆 || New ??? Rarity in My Fishing Brainrots! || ADMIN ABUSE FOI UM DESASTRE PRA MIM | MY FISHING BRAINROTS || ADMIN ABUSE FOI UM DESASTRE PRA MIM | MY FISHING BRAINROTS,Gamingarea || Roblox Bapo || WhyikyHD || Crazy Banjo || S4S Editz || SPAM || Taim and Odai || Kream Blox || FLUXEDY || FLUXEDY2,24
5203828273,Dress To Impress⭐,2026-02-08,163799,56817,188.29223647851876,"Types of players in the VALENTINES update in Dress to Impress!! #dresstoimpress #shorts #roblox || BEST HAIR COMBO IN THE DRESS TO IMPRESS VALENTINES UPDATE 😍🎀 #roblox #dresstoimpress #dti || *2025 quest*😨ALL THE SECRETS IN THE NEW UPDATE!! #trends #dresstoimpress #dti #dtiupdate #dtiroblox || dti valentines update pt.2 💘#roblox #4urpage #dresstoimpress #dtishorts #part3soon || Dress to impress VALENTINES update!  FREE ITEMS! NEW HAIR ,MAKEUP &amp; ITEMS | VIP EXCLUSIVES! || the NEW LOUNGE ON DRESS TO IMPRESS 😍 #dresstoimpress #dti #roblox || DID YOU NOTICE THIS SECRET IN DRESS TO IMPRESS??? #dresstoimpress #roblox #dti || how to send LOVE LETTERS on Dress to Impress #dresstoimpress #dti #roblox || Be Honest… Did I Pull It Off? 💅👀 #roblox #dti #shorts #dresstoimpress || Valentine’s has arrived to Dress to Impress!!! 💖💘🤩 #roblox #dresstoimpress #dti #robloxshorts",Mochiii || azuleaa || _ 𐙚𝑺𝒐𝒑𝒉𝒊𝒊𝒊𝒆𝒆ツ+*. || lia  || Beatbyshi || chronic fashion || itsfinlay || chronic fashion || IDarkDemonM Gaming || MGHkind,81
5650396773,a dusty trip [💎CLASSES],2026-02-08,19101,14057,35.882478480472365,A DESRT,Blakken,1
6048923315,[🎁Trading+GOJOv2]KAIZEN,2026-02-08,8561,2447,249.85696771557008,#jujutsushenanigans #roblox #jujutsukaisen Meguna Moveset First Move WIP Jujutsu Shenanigans || #edit #jujutsukaisen #roblox #jujutsu shenanigans #aura mais egu #aura +egu || 100-0 Mahito combo into Ult Animation #jjk #jjs #jujutsushenanigans #jujutsukaisen || Fighting Top 1 NA in JJS #jjk #jjs #jujutsushenanigans #jujutsukaisen || Megumi Rabbit Rain combo  #jjk #jjs #jujutsushenanigans #jujutsukaisen || Highest damage Combo with One Move? #jjk #jjs #jujutsushenanigans #jujutsukaisen || JUJUTSU SHENANIGANS #roblox #memes  #jujutsukaisen  #jujutsushenanigans  #robloxshorts #atualização || among us #roblox #edit #music #fzmez #kaizen #skelebonez #pmr #clutch #ryanrbxx #sab #stealabrainrot || Kaizen new Movement@Kaizen1Roblox #roblox #jjkgame #jujutsukaisen #kaizen #fypシ || The BEST Jujutsu Kaisen Combat I&#39;ve Seen.. | Kaizen #Roblox #Sukuna #JJK #JJS #Kaizen,VenTheFirst || Arthur_Editxxx || casuals || casuals || casuals || casuals || S4toru || DreamBlox || LaniBlox || Shredsy,25
9527851429,Save Brainrots from LAVA ,2026-02-08,37320,13012,186.8121733784199,Plants vs brainrots  || plants vs brainrots || 😱Playing PLANTS VS BRAINROTS After A Long Time Roblox New Update Plants vs Brainrots Gameplay || Trading my plants vs brainrots for steal a brainrot! #stealabrainrot #roblox #shorts #fyp || Every base in Save Brainrot from tsunami🤯 || Best BRAINROTS from Every Steal a Brainrot Update fr #shorts #viral || Plants vs Brainrots || Plants vs brainrots,diamond dasher || Bloodman599 || Vortex Gaming || EggPlayz || CoolVerse || Priya Ahmed || Blaise Markey || Huddy flag67,8
5580972377,💥 BUCKSHOT,2026-02-08,4052,2898,39.82056590752243,#cgsong #liriklagu #yosho #trends #trending #viral #clips #trickshots #edit #funk #gaming #viralclip || fling things and people trick shot  #roblox #trickshots,McWorker240 || LukeTheRock,2
7332711118,Brainrot Evolution,2026-02-08,22809,18083,26.131556391185335,roblox escape tsunami steal brainrot live || roblox escape tsunami steal brainrot live || (youtube shorts) STEAL A BRAINROT VALENTINES UPDATE+NEW LUCKY BLOCKS || Duck King gets Cursed Reinito Sleighito 1.7B/s! 👑🦌 (Steal a Brainrot Roblox) || Wer will traden steal was von brainrot #roblox || How To Get Popcuru And Fizzuru Brainrot In Find the Brainrot [370] #findthebrainrot #roblox || How To Get Popcuru And Fizzuru Brainrot In Find the Brainrot [370] #findthebrainrot #roblox || The rarest items you must find in steal a brainrot #stealabrainrot #roblox || The rarest items you must find in steal a brainrot #stealabrainrot #roblox || Karkerkar karkur Evolution vs Steal Brainrot CHALLENGE #shorts #roblox #роблокс #gmod #sfm,Bro Slays || Bro Slays || Panoi7  || GhosT Zombies || code lorenzo YT || Peggy Network || Peggy Network || Evan Booth || Mathias Lee || КАНЗО-РБ,13
7658676858,Glide Tower,2026-02-08,5561,4171,33.32534164468952,とりあえず周回しまくったけどAFKのがいいってマジ？ #3【スポンジボブタワーディフェンス1 / SpongeBob Tower Defense】ロブロックス || 🔴LIVE - Spongebob tower defense and fisch admin abuse || Going over the new SpongeBob Tower Defense Update || Going over the new SpongeBob Tower Defense Update || SpongeBob tower defense || SPONGEBOB TOWER DEFENSE PRESTIGE ULTIMA AND ADMIN ABUSE LIVE! || SPONGEBOB TOWER DEFENSE PRESTIGE ULTIMA AND ADMIN ABUSE LIVE! || Me playing SpongeBob Tower Defense  || Gambling in Spongebob tower defense! || SpongeBob Tower Defense | Admin abuse and new Update!,すそぽけはのんびり遊びたい || Iggy || TunaMatty || TunaMatty || Anyone wanna trade || ItsMoonlight || ItsMoonlight || King kj || Tspider37  || Sidekicker Gaming,19
88070565,[👵] Welcome to Bloxburg 🏡,2026-02-08,24370,18567,31.254376043518068,EXCLUSIVE | 319 TEAM Saudi Drift Event In ROBLOX Kingdom World On “Welcome To Kingdom World” Street.,King AL-FWAT F-912,1
3308103880,Maple Hospital 🍂 [FLOOR 3],2026-02-08,17325,12451,39.14545016464541,Roblox Maple Hospital giving You A touring where everything Is And Helping Sick Patients || Roblox shenanigans || Maple Hospital Compilation 16+ || I’ll be on maple hospital all week || #roblox #haveitoldyoulatelythatiloveyou (Its my maple hospital outfit on Roblox!! || 玩ROBLOX Maple hospital楓葉醫院 ，衝225等,Rosella 2681 || Snoozie•Arts💤 || Peachyplays || Ash1813 || 胡蝶香奈惠,5
2992873140,Emergency Hamburg,2026-02-08,24786,4668,430.97686375321337,this is my Last Video about emergency  Hamburg #roblox || Emergency Hamburg-Hars#roblox#emergencyhamburg @Jantox_YT @AROXU_YT || بث مباشر  emergency Hamburg || 🔴 LIVE RP FR EMERGENCY HAMBURG #shorts #roblox || /kod do serwera w roblox w grze emergency hamburg kod d6ze463w || Gramy w Emergency Hamburg na prywatnym serwerze Odgrywamy RP! Live 6 || EMERGENCY HAMBURG DAİLY LİVE I BUYED NEW AVATARRRRRRRRRRR || ATRASARON LA ACTUALIZACION DE EMERGENCY HAMBURG??? 💀🙏 || Pingt alle Emergency Hamburg im Chat!🥹 || Se retrasa la próxima  actualización de Emergency Hamburg #emergencyhamburg,YTflameSniperEH || Jantox TV || مملكة علي-alikingdom  || Rocsel Studio || krycha || Łuki || ZET_Zeus || Mixer783 || Vipex || EHGame ,25
7546582051,[2X] Dungeon Heroes ⚔️,2026-02-08,5322,1935,175.03875968992247,the NEW LOUNGE ON DRESS TO IMPRESS 😍 #dresstoimpress #dti #roblox,chronic fashion,1
2668101271,Fling Things and People,2026-02-08,47174,33646,40.20685965642276,How to throw people super far in Fling Things and People #roblox || lag test on my pc (ALSO FLING THINGS AND PEOPLE #3) || (Fling things and people) || Fling things and people || fling things and people funny moment #roblox || My sister playing &quot;fling things and people&quot; for the first time! || Playing fling things and people with ybarra (Roblox) || fling things and people trick shot  #roblox #trickshots || Tutorial on how to fling people far in fling things and people! || new fly gliitch in Fling Things And People,ForFlyVR || cynthia osorio || Kate ELO || calamitymod19 || EclipseBloxian || Terry your girl 😝 || Truedrippi6 || LukeTheRock || Diana_Editzz || Idk_on_YT,28
7398552394,A desrt [SANDBOX],2026-02-08,23912,11584,106.42265193370166,lag test on my pc (ALSO FLING THINGS AND PEOPLE #3) || I Destroyed All Brainrots!!😈🌻(Plants VS Brainrots ASMR) || 🌊 MEGA ADMIN ABUSE 🌊 ESCAPA DEL TSUNAMI POR BRAINROTS 🌊 ROBLOX 🌊 || El juego MÁS VIRAL de Roblox en 2026 🤯🔥 || ⌊BLUE LOCK: RIVALS!⌉ 𖣐👅𖣐 ⌊REWORK DO DESTRUIDOR!⌋ ⚽🥅 ⌊Mostrando o REWORK do RIN ao VIVO|LIVE⌋ || Wer will traden steal was von brainrot #roblox || ADMIN ABUSE FOI UM DESASTRE PRA MIM | MY FISHING BRAINROTS || ADMIN ABUSE FOI UM DESASTRE PRA MIM | MY FISHING BRAINROTS || Mapa Diferenciado! Knockout #roblox #knockout #shortsfeed #viralshorts || COMPREI A ROUPA DO DESPERTAR JUJUTSU SHENANIGANS #roblox,cynthia osorio || clownfish456 || RUYAX || Samur el crack || PLAYTIME || code lorenzo YT || FLUXEDY || FLUXEDY2 || DRAXSK BR || Otaku Cortes,40
9595795883,My Mining Brainrots,2026-02-08,13396,7414,80.68519018073914,plants vs brainrots || Best my fishing brainrots pull? #viral #music #viralmusic #roblox #viralvideo #fyp #fypシ #funny || I became the RICHEST player on My Fishing Brainrots! || Today is a perfect admin abuse in my fishing brainrots!😆 || New ??? Rarity in My Fishing Brainrots! || ADMIN ABUSE FOI UM DESASTRE PRA MIM | MY FISHING BRAINROTS || ADMIN ABUSE FOI UM DESASTRE PRA MIM | MY FISHING BRAINROTS || MY FISHING BRAINROTS ADMIN ABUSE || MY FISHING BRAINROTS ADMIN ABUSE || New ??? Rarity in My Fishing Brainrots!,Bloodman599 || S4S Editz || SPAM || Taim and Odai || Kream Blox || FLUXEDY || FLUXEDY2 || CosmicStar || CosmicStar || Kream Blox,25
8080863905,Slap DUELS [🎉UPD!],2026-02-08,6558,3784,73.30866807610994,🌊 MEGA ADMIN ABUSE 🌊 ESCAPA DEL TSUNAMI POR BRAINROTS 🌊 ROBLOX 🌊,RUYAX,1
9649298941,[🐰] Survive LAVA for Brainrots!,2026-02-08,113366,15569,628.1520971160639,plants vs brainrots || New LEADERBOARD in Escape Tsunami For Brainrots! || NEW UPDATE ADMIN ABUSE in Roblox Escape Tsunami For BRAINROTS || I Upgraded Brainrots Using SECRET RECIPES in Escape Tsunami For Brainrots || Another update of money on escape tsunami for brainrots || I Got OWNER POWERS in Escape Tsunami For Brainrots!! || TRADING + MORE Event | Escape Tsunami For Brainrots! || MOST BROKEN GLITCH! How to get Titanic + DUPE Them Infinitely in Escape Tsunami for Brainrots || 🔴 Roblox STEAL A BRAINROT GIVEAWAY LIVE - Escape Tsunami For Brainrots 4 || SECRET UPDATE ADMIN ABUSE + GIFTING FREE DIVINE BRAINROTS in Roblox Escape Tsunami For Brainrots,Bloodman599 || ceroblox || Tehri313 || Vindooly || Gaming Chanel3423 || KAYE || BloxyS3 || YamashiP || Pixxi67 || RazorFishGaming,14
7709344486,Steal a Brainrot,2026-02-08,374820,249889,49.994597601334995,Plants vs brainrots  || plants vs brainrots || I Destroyed All Brainrots!!😈🌻(Plants VS Brainrots ASMR) || Trading my plants vs brainrots for steal a brainrot! #stealabrainrot #roblox #shorts #fyp || roblox escape tsunami steal brainrot live || SAMMY Needs a Major Update Escape Tsunami Steal A Brainrot #shorts #stealabrainrot  #roblox || Escape Tsunami LTM Scam In Steal A Brainrot 😭 #stealabrainrot #roblox #cbum || roblox escape tsunami steal brainrot live || 🔴 Roblox STEAL A BRAINROT GIVEAWAY LIVE - Escape Tsunami For Brainrots 4 || STEAL A BRAINROT GIVEAWAY LIVE | STEAL A BRAINROT FREE SECRETS + FREE BRAINROT GODS,diamond dasher || Bloodman599 || clownfish456 || EggPlayz || Bro Slays || LabBrain || HENZOO || Bro Slays || Pixxi67 || Demsy,86
8572854650,Be a YouTuber! 🔴🎥,2026-02-08,13367,3972,236.53071500503526,Czy youtuber z pcd odejdzie? (Polish car driving) #pcd #roblox #youtuber #odejdzie || YouTubers Are About to Get DETHRONED in Escape Tsunami for brainrots (ROBLOX) || Happy Valentines Day ❤️ MegRox update #valentinesday #youtuberevier #❤️#happyvalentinesday,INFORMACJE PCD || James Skywalker || MegRox,3
2440500124,DOORS 👁️,2026-02-08,16099,9811,64.09132606258282,MM2 pero la rulets ELIGE a quien mato (con seguidores)  #mm2 #murdermystery2  #roblox #robloxshorts,Daavisst,1
2251388500,Twisted [BETA],2026-02-08,2391,1803,32.61231281198003,🥵🔥Don&#39;t Play Roblox 99 Nights Forest Without This Team Combo! #roblox #robloxshorts #robloxedit || This Team Clears EVERYTHING! (Anime Vanguards) || अलग-अलग राज्यों में Knockout बीयर की कीमतें (स्टेट वाइज रेट)💸💰#BeerPrice#StateWiseRate #KnockoutBeer || Highest Winstreak You&#39;ve Fought? #rivals #edit #phonk #robloxedit #shorts #gaming,Anie Roblox  || ranran || Business daily update || ItsDonutBlox,4
7787359931,Kingdom World,2026-02-08,7173,1206,494.77611940298505,EXCLUSIVE | 319 TEAM Saudi Drift Event In ROBLOX Kingdom World On “Welcome To Kingdom World” Street.,King AL-FWAT F-912,1
8834587397,Find the Brainrot [508],2026-02-09,9243,4968,86.05072463768117,Ne jucam Break a Lucky Block( Update) + Facem tradeuri pe steal a brainrot || Break A Lucky Block To Steal A Brainrot 🤩🔥 | #roblox #shorts #stealabrainrot || How to Get BOBA PANDA | Find the Brainrot [370] || How To Get Popcuru And Fizzuru Brainrot In Find the Brainrot [370] #findthebrainrot #roblox || How To Get Boba Panda Brainrot In Find the Brainrot [362] - Roblox || How To Get Talpa Magini in Find the Brainrot [370] Roblox (New Brainrot) || How to Get POPCURU AND FIZZURU | Find the Brainrot [370] || Today&#39;s update on Find Brainrot Part 2 || ENCUENTRA ya A POPCURU and FIZZURU en FIND THE BRAINROT🔥 || How To Get Popcuru and Fizzuru in Find the Brainrot [370] Roblox (New Brainrot),Ovidiu-Alexandru Dragota || BHAIYA GAMING || K R Y S T I N ♡ M A R I E || Peggy Network || Peggy Network || Seriously Dude || K R Y S T I N ♡ M A R I E || ITB Roblox || Juanitotop || Seriously Dude,107
5912620016,[⏳SOON⏳] Anime Guardians,2026-02-09,3910,2822,38.57193479801559,"استعرض روكيا الفنقارد الجديد [❄️WINTER❄️] Anime Vanguards في تحديث الجديد شكله رهيب #roblox !!🔥🔥 || Anime Vanguards: 💰 สอนปั้น &quot;ตัวเงิน&quot; พร้อมสอนวิธีเล่นที่ดีที่สุด!! ใช้ตัวเงินคู่ไหนคุ้มที่สุด!? || The BEST Trait Reroll Farming Methods in Anime Vanguards! || КАК ВЛИЯЕТ МЕМОРИЯ НА СТАРЫХ ЮНИТОВ В ANIME VANGUARDS!!!!! || I got MONARCH Dio Over Heaven (Anime Vanguards) #roblox #animevanguards || Anime Vanguards l สอนลงกิจกรรมใหม่ ได้รอบละ200,000ชิ้น!!! และใช้เวลาน้อยที่สุด || *NEW* 400K Per Hour Winter Presents Method In Anime Vanguards Update 10.5! || Catching Up In Anime Vanguards! || WINTER BANNER ANIME VANGUARDS ROBLOX #roblox #animevanguards || TRY TO GET RUKIA/ICE QUEEN WITH 300.000+ PRESENT26 ANIME VANGUARDS ROBLOX",ريلي┃Relly || Zeroz Kingner || Sebbyastian || Vinlandav || Slaberz || Lil2play || ProjectSbo || Jonaslyz || Zeref Dragneel || Zeref Dragneel,30
1054526971,Blackhawk Rescue Mission 5,2026-02-09,5444,4037,34.848297213622295,first clip of the update #blackhawkrescuemission5,brm5 pilot,1
