universe_id,game_name,det_at,det_ccu,week_ago_ccu,growth_percent,video_titles,channels,n_videos
383310974,[🦈] Adopt Me!,2026-03-04,300916,228387,31.75728040562729,"QUITTING ADOPT ME, FIRST COME FIRST SERVE, CHECK CHANNEL AND VIDEO DESCRIPTION! #adoptme #roblox || In comments #adoptme #adoptmecheat #adoptmescript #adoptmeupdate #robloxscript #adoptmeroblox || THOSE PENGUINS CAME FROM HELL #adoptmeroblox #roblox #adoptme #shorts || Endangered egg swap in adopt me!! #adoptme #adoptmeegg #adoptmenewupdate #fyp #shorts || COPY ANY GAMES IN ROBLOX #robloxshorts #bladeball #adoptmeupdate #robloxmeme #stealabrainrot #roblox || 🐲✨🏜️*NEW*ADOPT ME PET WEAR EDITOR UPDATE LEAK!🌴✨🐲ADJUST,CHANGE SIZE OF ACCESORIES &amp; MORE!🗻🐲#adoptme || Let&#39;s Talk About The Endangered Egg, in Adopt Me! #adoptmeupdate #adoptmeegg #robloxadoptme || AVATAR ADJUSTMENTS UPDATE COMING TO ADOPT ME!! #adoptme #roblox #viral || 🔴 LIVE - PLAY ROBLOX TRADING AND CHATTING ADOPT ME  #roblox    #adoptme || dublando memes de Dandy&#39;s World! #dandysworld #memes #humor #dublagem",AbbiePlaysAdoptMe107 || Adm scripts || PENS || 𝐚𝐝𝐨𝐫𝐛𝐬𝐱𝐦𝐚𝐞🌷 || Adoptme give away || CookieFrost || Anonymous Cat || Poppy || rileyyyroblox || Mikaely_Undertale,31
3168615253,Ability Wars,2026-03-04,2247,749,200.0,Flee the facility ,rxsa_rblx,1
372226183,Flee the Facility,2026-03-04,13920,10863,28.1460001841112,Jogando  flee the facility (espero que gostem ;-;) || This ONE Word Starts EVERY Argument in Flee the Facility... || I’m The Saviour in Roblox Flee the Facility! || Voltei no marretão!(roblox flee the facility) || Roblox - JOGANDO MARRETÃO! |flee the facility | || Flee the facility ✌️ || Can We Escape This Prison Facility!??? We had to Flee! Flee The Facility! FT The Fellas || Flee the Facility | Voice-Chat With Randoms || Flee the facility  || Back to Flee The Facility Live,shinazugawa.genya. || Protonical || TotallyCalPlayz || o Isaqueblox || Doce Jujuba! || Kristy O || ACH_66  || r8nnie || rxsa_rblx || NinjaGaming,19
9100068452,[❄️] Park a Car🅿️,2026-03-04,2389,1587,50.535601764335226,Funny Cat vs. Dog in Steal Brainrot Roblox. Part 5: Arson  #brainrot  #roblox #stealabrainrot || Emergency hamburg Rampage as crime 😾 @LeftDC-33 #emergencyhamburg #emergencyresponse #roblox || The Best Gem Methods for VANGUARD ALUCARD &amp; MEMORIA in Anime Vanguards! || hunty zombie (part 2 hard mode),Cucu Show || LeftDC || JimsterATD || lolbit gamer,4
8080863905,Slap DUELS [🎉UPD!],2026-03-04,2689,2082,29.154658981748323,🔴 STEAL A BRAINROT GIVEAWAY &amp; DUELS LIVE | SAB TRADING LIVE | NEW TRADING MACHINE! ADMIN ABUSE || 🔴 STEAL A BRAINROT GIVEAWAY &amp; DUELS LIVE | SAB TRADING LIVE | NEW TRADING MACHINE! (Shorts Stream),Panda Z Greysen || Panda Z Greysen,2
6218783244,Ball Tower Defense [⭐AAA UPDATE⭐],2026-03-05,1414,1097,28.89699179580675,I OPENED ONE OF EVERY CRATE IN SPONGEBOB TOWER DEFENSE.. || SpongeBob Tower Defense | Super Star Chicken,RDMVigilance || Sidekicker Gaming,2
9692511432,Trading Empire [BETA],2026-03-05,2419,452,435.17699115044246,Trading for gold la casa boo 🤩🤩 #roblox #steal brainrot || Pov: after trading update in Steal a brainrot 💪 #roblox #stealabrainrot #shorts || Steal a Brainrot Trading  in Roblox | AIKOO || Admin Abuse + Tacos Tuesday &amp; Trading Live In Steal A Brainrot #stealabrainrot #roblox #livestream || 🔴 LIVE TRADING STEAL A BRAINROT | LIVE TRADING+ GIVEAWAY TACO TUESDAY || 🔴 STEAL A BRAINROT GIVEAWAY &amp; DUELS LIVE | SAB TRADING LIVE | NEW TRADING MACHINE! ADMIN ABUSE || 🔴 STEAL A BRAINROT GIVEAWAY &amp; DUELS LIVE | SAB TRADING LIVE | NEW TRADING MACHINE! (Shorts Stream) || TRADING From Battlepass to SHINY DIAVOLO (The Return) in Roblox Anime Vanguards! (Day 3),Goku gaming || Margurite || Aikoo || YOUTUBE-ASGHAR || SAB LEGIT TRADING  || Panda Z Greysen || Panda Z Greysen || Nite,8
5315312115,[RP] Pine Ridge,2026-03-05,317,242,30.991735537190085,Aku Pertama Kalinya Cobain Resident Evil Requiem.. (HORROR BANGET?!),Pak GM,1
1720936166,[UPD] All Star Tower Defense,2026-03-06,356,277,28.51985559566787,I OPENED ONE OF EVERY CRATE IN SPONGEBOB TOWER DEFENSE.. || Addicted to anime vanguards #roblox #animevanguards #towerdefense || I Returned after 10 Months and Went Noob To Pro in SpongeBob Tower Defense || playing spongebob tower defense || 5 Years Worth of Progress... in All Star Tower Defense Roblox,RDMVigilance || Nyxen || Kadmos Roblox || FRMoxel || AdministrationTV,5
8459032065,[🍀2X + UPD 2.5] Anime Tactical Simulator,2026-03-07,25581,17555,45.71916832811165,How To Equip Avatars In Anime Tactical Simulator  || 🔴Live Roblox l anime tactical simulator อัพเดทแรกมาแว้วววว! || 🔴 Live Roblox | Anime Tactical Simulator อัพเดทใหม่ พร้อมฟาร์มทีมใหม่ || สรุป Update 1 !! มีอะไรใหม่บ้าง? โค้ดอะไรบ้าง [Roblox Anime Tactical Simulator] || 🔴Live - | Roblox | Anime Tactical Simulator UPD 1 มาเล่นกัน !!! || รออัพเดต 1 กันดีกว่า | Roblox Anime Tactical Simulator || Quảy Rift Update 1 nào anh em | Anime Tactical Simulator | ATS || [ 🔴 Live ] Roblox | Anime Tactical Simulator F2P เล่น update #7 || 🔴Anime Tactical Simulator นั่งรอ update # 2 || ROBLOX🔴6  [🎭UPD1] Anime Tactical Simulator อะนิเมะยุทธวิธีจําลอง อับเดทแล้ว รอทั้งคืน #easydonate,Latte Live || PMAIL || Gamezamini || MR. Meow za || Kisé || Skythunderz || Mikorin || VinDerRa || PINKkung(P L O) || ROD2026 MGM SS9,26
2992873140,Emergency Hamburg,2026-03-07,11821,9358,26.319726437272923,Emergency Hamburg roblox S.E.K || EMERGENCY HAMBURG🚔!! SOLO CRIME GAMEPLAY🥷ON BENTLAY 🚗!! || Emergency Hamburg || Oceniam wszystkie karetki w emergency hamburg #emergencyhamburg #shorts #ocenka || حياكم Emergency Hamburg || Amerika sunucusunda yargı dağıttım -Part 2- Emergency Hamburg-Roblox || Playing live roblox emergency hamburg || Roblox RP Emergency Hamburg serveur privé 🇨🇵R.P France || RP Roblox Emergency Hamburg serveur privé 🇨🇵R.P France || RP Roblox Emergency Hamburg serveur privé 🇨🇵R.P France,DVX || VantyXx || Henri Ramosaj || PoLanD Pop (PopBear) || حسن | 7assan || [TMF] Kadir ||  Mustafa vlogs  || XFR-REDHOODFR🐉 || XFR-REDHOODFR🐉 || XFR-REDHOODFR🐉,16
6931042565,[UPD] Volleyball Legends,2026-03-07,65110,47807,36.19449034660196,Novo Update e personagem novo no VolleyBall Legends || 🔥KIJO🔥 O melhor spiker  do Volleyball Legends? || Kijo is Coming o Volleyball Legends and Is BROKEN || O NOVO SPIKER - KIJO NO VOLLEYBALL LEGENDS! #roblox #volleyballllegends #update #haikyuu #kijo || Jogando a nova UPDATE do Volleyball Legends (slot gratis + spiker novo) || KIJO - PRIME SANJU? НОВЫЙ SECRET SPIKER УЖЕ В ИГРЕ!  #volleyballlegends #roblox #vlb #kijo #kijovlb || Koji serves in Volleyball Legends #roblox #robloxshorts #robloxedit #robloxgames #volleyball #fyp || MVP Koji y Bundles en Volleyball Legends #roblox #robloxshorts #robloxedit #robloxgames #fyp #parati || [NEW] Quick Showcase KIJO | Volleyball Legends #volleyballlegends #vollleyball #haikyuu #roblox #fyp,OliverNico || Joakings || Krazy || JGR Blox || Calvo || Indra || Kybe || Kybe || syde,9
6508759464,Grace [GRACE BUT EVIL],2026-03-07,23297,17690,31.698699830412664,SPRAWDZIŁEM ZMIANY W DARŁOWIE Z PRZYPADKOWYMI GRACZAMI w PCD - Polish Car Driving || Roblox RP Emergency Hamburg serveur privé 🇨🇵R.P France || RP Roblox Emergency Hamburg serveur privé 🇨🇵R.P France || RP Roblox Emergency Hamburg serveur privé 🇨🇵R.P France || RP Roblox Emergency Hamburg serveur privé 🇨🇵R.P France || Ranking EVERY Special Grade Innate in Jujutsu Infinite! (Tier List),TheHogaty || XFR-REDHOODFR🐉 || XFR-REDHOODFR🐉 || XFR-REDHOODFR🐉 || XFR-REDHOODFR🐉 || Relonax,6
6325068386,[❄️ HIORI] Blue Lock: Rivals,2026-03-07,23754,13900,70.89208633093526,Blue Lock: Rivals – The Genius &amp; The Egoist Evolution Update || The art off Rin blue lock rivals! || The art off Sae blue lock rivals! || The art off chigiri blue lock rivals! || The art off Nagi Blue lock rivals! || The art off karasu blue lock rivals! || Playing Blue Lock Rivals with my friends (Part 2) || The art off isagi yoichi blue lock rivals! || The art off hiori yo Blue lock rivals! || Blue lock rivals new update,GAURAB BARDHAN || kyoshi gamer  || kyoshi gamer  || kyoshi gamer  || kyoshi gamer  || kyoshi gamer  || CrySta1!ty || kyoshi gamer  || kyoshi gamer  || KGhostface ,17
4938220315,[YOURSELF TOWER] Skibi Defense,2026-03-07,4002,3080,29.935064935064936,Addicted to anime vanguards #roblox #animevanguards #towerdefense || I Returned after 10 Months and Went Noob To Pro in SpongeBob Tower Defense || playing spongebob tower defense || The Updated Anime Vanguards Tier List Must Watch Video?! #gaming#animevanguards#roblox#towerdefense || HİÇ KİMSENİN BULAMADIĞI GİZLİ KARAKTERİ ÇIKARDIM! 😱 | SpongeBob Tower Defense || ТОЛЬКО ТАК МОЖНО ПОЛУЧИТЬ В 10 РАЗ БОЛЬШЕ КЕЙСОВ В ИВЕНТЕ ПРИЗМАНИЯ В SPONGEBOB TOWER DEFENSE || everyone who have Holo smitty SpongeBob tower defense Roblox #roblox #spongebobtowerdefense || Dobijamy 1000 fal SpongeBob Tower Defense || The OG Damage Farm Method | All Star Tower Defense || [Mini-UPDATE] Classic Units Return to All Star Tower Defense?,Nyxen || Kadmos Roblox || FRMoxel || ItsOnyx || Kemsa || Игро-Маня || System1234 || EZ_OFFICIAL3727 || AdministrationTV || AdministrationTV,11
8991105066,[🌴Summer] Idle Defense,2026-03-07,1551,712,117.8370786516854,Addicted to anime vanguards #roblox #animevanguards #towerdefense || I Returned after 10 Months and Went Noob To Pro in SpongeBob Tower Defense || Probando la nueva a actualizar de SBTD &quot;prismania!!&quot; Gameplay de spongebob tower defense| AlkaBlox || SpongeBob tower defense admin abuse || SPONGEBOB TOWER DEFENSE ADMIN ABUSE LIVE! || playing spongebob tower defense || SpongeBob Tower Defense | New update! one of my last 2 streams || 5 Years Worth of Progress... in All Star Tower Defense Roblox || The Updated Anime Vanguards Tier List Must Watch Video?! #gaming#animevanguards#roblox#towerdefense || Roblox: SpongeBob Tower defense Admin Abuselive stream  Join up or watch if you chilling and Vibing,Nyxen || Kadmos Roblox || AlkaBlox || fnfjayfix || WonderBH || FRMoxel || Sidekicker Gaming || AdministrationTV || ItsOnyx || ICyyGREENUP Gaming ,30
7008097940,[🔥] Ink Game,2026-03-07,15277,11432,33.63803358992302,"How To Farm 200,000 GEMS PER DAY &amp; BIRB Under 40 SECONDS In Anime Vanguards!? (FULL GUIDE) || The Top 5 Most Forgotten Gamemodes in Anime Vanguards! || This Spark Team Destroys Any Gamemode In Anime Vanguards || Clear CID BIRB Raid In Under 40 Seconds In Anime Vanguards!? || 🔥 I Finally Got Reze in Anime Vanguards! || NEW *SHINY* WHITEBEARD IS INSANE IN Anime Vanguards!  || EMERGENCY HAMBURG🚔!! SOLO CRIME GAMEPLAY🥷ON BENTLAY 🚗!! || Indonesia Car Simulator Gameplay 🚗 | Real Driving in Indonesia | Car Driving Game || MONARCH Makima (Demon Leader) Is Actually BROKEN In Anime Vanguards... 💀 || SAMBUNG KATA AWALAN X DI ROBLOX... #roblox #games #gaming #funny #gameplay #robloxedit #gameandroid",TemBlox || JimsterATD || ChaosRBX || TemBlox || auden || Vonex || VantyXx || Gameversex Yt  || MrMushroomGuy TDs || KLIP GAME,21
6594435384,SpongeBob Tower Defense🍍,2026-03-07,34170,20480,66.84814453125,Addicted to anime vanguards #roblox #animevanguards #towerdefense || I Returned after 10 Months and Went Noob To Pro in SpongeBob Tower Defense || Probando la nueva a actualizar de SBTD &quot;prismania!!&quot; Gameplay de spongebob tower defense| AlkaBlox || SpongeBob tower defense admin abuse || SPONGEBOB TOWER DEFENSE ADMIN ABUSE LIVE! || playing spongebob tower defense || SpongeBob Tower Defense | New update! one of my last 2 streams || The Updated Anime Vanguards Tier List Must Watch Video?! #gaming#animevanguards#roblox#towerdefense || Roblox: SpongeBob Tower defense Admin Abuselive stream  Join up or watch if you chilling and Vibing || HİÇ KİMSENİN BULAMADIĞI GİZLİ KARAKTERİ ÇIKARDIM! 😱 | SpongeBob Tower Defense,Nyxen || Kadmos Roblox || AlkaBlox || fnfjayfix || WonderBH || FRMoxel || Sidekicker Gaming || ItsOnyx || ICyyGREENUP Gaming  || Kemsa,21
5375172057,VEF [OLD],2026-03-07,132,51,158.8235294117647,"car driving, penetrate cold fog , at Puncak Pass Mountain ( Cipanas, West Java , Indonesia ) #drive || Escape Tsunami For Brainrots #roblox #gamingytkishan #livestream #shortslive || Escape Tsunami For Brainrots #roblox #gamingytkishan #livestream #shortslive || Escape Tsunami For Brainrots #roblox #gamingytkishan #livestream #shortslive || Escape Tsunami For Brainrots #roblox #gamingytkishan #livestream #shortslive || Escape Tsunami For Brainrots #roblox #gamingytkishan #livestream #shortslive || Escape Tsunami For Brainrots #roblox #gamingytkishan #livestream #shortslive || Roblox - Ada pocong di hospital yang disumpah LIVE",DISPLAY-IN APA AJA || Gaming YT kISHAN || Gaming YT kISHAN || Gaming YT kISHAN || Gaming YT kISHAN || Gaming YT kISHAN || Gaming YT kISHAN || Buasir Otak TV,8
8316902627,[🕵️] Plants & Brainrots 🌻,2026-03-07,10895,6902,57.852796290930165,Giveaway My Brainrot In Escape Getting Crushed For Brainrot || siapa yang punya base diamon &amp; gold di escape getting crushed for Brainrot || aku main escape getting crushed for brainrot || Last jump 😱 #roblox #newgameinroblox #stealabrainrot || Escape getting crushed for brainrot || My fishing brainrots || Brainrots Divine Pinguin My Fishing Brainrots Roblox #shorts #roblox #haskelip || Nova atualização do Laboratório brainrot jogo do Luan Clash WAR. Consegui Brainrots secretos || BRAINROTS DE LAVA CHEGARAM NO LABORATORIO BRAINROT!! #roblox #brainrot #csantana || how to make the plants vs brainrots 🤖,YOGU_AndFriends || Itsme_UTSM || kepala batu sigma || AliGaming Pro || OC GAMING || Shay Yadev || HasKelip || Luiz Antonio Games e Aventuras || Carlos Santana Games || sanaf the LEGO engineer,51
2640407187,(UPDATE!) Car Driving Indonesia,2026-03-08,20345,9854,106.46437994722955,"MAM NOWY DOM! | PRAWDZIWE ŻYCIE Polish Car Driving #19 [S2] || KUPIŁEM SWÓJ PIERWSZY SAMOCHÓD (Polish Car Driving Roblox) || PO TUNINGU FURY ZOSTAŁEM PIRATEM DROGOWYM... *Polish Car Driving Roblox* || DANUR : The Last Chapter x CDID Car Driving Indonesia CDID Selesaikan Quest MD Picture || maaf cinematic masih pecah#cdid #robloxcdid #roblox #robloxshorts #cdidcinematic #cdidindonesia || LIVE EVENT PULANG BASAMO DI CAR DRIVING INDONESIA ROBLOX!!, SPECIAL RAMADHAN || LIVE QUEST HOROR DANUR DI ROBLOX MAP CAR DRIVING INDONESIA (CDID) || How To Finish CDID X Danur Quest  • CDID - Car Driving Indonesia ❨Roblox❩ || EVENT DANUR DI CDID. DANUR×CDID! FULL QUEST CUMA 40 MENIT AJA!(CAR DRIVING INDONESIA ROBLOX) || SUDIRMAN MOST WANTED | Car Driving Indonesia | CDID","Dawszczeq || RobloxBlowek || Jawor, ale GRY || Adi ID || Kazumii || Dazvree || Mikdad Musadad || ArhasAr || KING.RBL. || Occhio",12
9186719164,[🍀3x Luck🍀] Sailor Piece,2026-03-08,41049,31536,30.16552511415525,Sailor Piece Quick Damage Guide,BloxyS3,1
5750914919,Fisch ⚓ [CREWS],2026-03-08,51944,41285,25.818093738646,😱 La secret combination Gratis Bekommen! ❤️🎁🔥  Steal a Brainrot Roblox Deutsch || MY FISHING BRAINROTS ADMIN ABUSE BCOZ IM BORED || My fishing brainrots admin abuse + update || #my fishing brainrots || My fishing brainrots admin abuse Saturday 7th march 2026 hope u all enjoyed love yall thx for coming || Roblox and great game My Fishing Brainrots || MY FISHING BRAINROTS SATURDAY ADMIN ABUSE *KINDA LUCKY* || my fishing brainrots admin abuser || My Fishing brainrots Admin abuse || MY FISHING BRAINROTS ADMIN ABUSE,Anifakt Gaming || JBREUBZ || MrDavidBlox || FluxRealm_1 || macauleylovesroblox || Swag Natsu || Rayan official  || TheGamerForever || E’s Bucket Boys || Knox respawns ,27
648454481,[🎮CONTROLLER🎮] Grand Piece Online,2026-03-08,17716,11299,56.79263651650589,RUMAH SAKIT PENGHUNI POCONG | Roblox - Pocong: Cursed Hospital [Beta] [Scary Horror] Piece Online,Elz,1
7883776681,Racket Rivals ,2026-03-08,11552,8685,33.010938399539434,The art off Rin blue lock rivals! || The art off Sae blue lock rivals! || The art off chigiri blue lock rivals! || The art off Nagi Blue lock rivals! || The art off karasu blue lock rivals! || The art off isagi yoichi blue lock rivals! || The art off hiori yo Blue lock rivals! || The art off otoya Blue lock rivals! || The art bachira blue lock rivals!,kyoshi gamer  || kyoshi gamer  || kyoshi gamer  || kyoshi gamer  || kyoshi gamer  || kyoshi gamer  || kyoshi gamer  || kyoshi gamer  || kyoshi gamer ,9
3990106548,Baddies 💅,2026-03-08,14179,10871,30.42958329500506,I’m Addicted to 99 Nights#roblox #robloxshorts #shorts,Popi Kika,1
9753814298,Swing Obby for Brainrots!,2026-03-08,88319,11736,652.5477164280845,Escape Tsunami For Brainrots Phantom update roblox NEW GHOST SHIP FOR BRAINROTS 😱 || DIVINE BLOCK in Escape Tsunami for Brainrots! || What’s the CRAZIEST possible wave in escape tsunami for brainrots || Bebe Sammy Este SUPARAT in Escape Tsunami For Brainrots... #roblox #escapetsunamiforbrainrots || Testez RETETE pentru INFINITY in Escape Tsunami for Brainrots! || Live 🔴 |  ADMIN ABUSE COUNTDOWN in Escape Tsunami for Brainrots || Escape Tsunami For Brainrots วิธีหากล่องDivine block โครตง่าย #fyp#roblox#escapetsunamiforbrainrots || IL METODO PER OTTENERE INFINITY SU ESCAPE TSUNAMI FOR BRAINROTS! || Bacon vs Every Tsunami | Escape Tsunami for Brainrots 🌊😂 #bacon #roblox #escapetsunamiforbrainrots || Trolling YouTuber With MODDED Escape Tsunami For Brainrots!!,UNLIII || RafaelG || Kayo Roblox || EED Eagle  || RafaelG || ThijmenVC || iFlamme || DoC || BroBaconRbx || KAYE,20
9592052490,Pocong: Cursed Hospital [Beta] [Scary Horror],2026-03-08,13511,5013,169.51924995012965,MENYESAL AKU KERJA PUKUL 3:00 AM SEBAB KENA KACAU....😱!!!!-Pocong cursed hospital(ROBLOX) || Katanya serukah? - Pocong Cursed Hospital Roblox || Roblox - Ada pocong di hospital yang disumpah LIVE || RUMAH SAKIT PENGHUNI POCONG | Roblox - Pocong: Cursed Hospital [Beta] [Scary Horror] Piece Online || Hospital mane ni bro.. (Pocong: Cursed Hospital) MALAYSIA || pocong cursed hospital #roblox #ytshorts #trending || Como COMPLETAR POCONG: Cursed Hospital || Aku Bermain Pocong : Cursed Hospital Di Roblox... || 😨😨#Pocong: Cursed Hospital [Beta] [Scary Horror]#😨😨 || ROBLOX - Pocong: Cursed Hospital [Full Walkthrough],KHAYS CHANNEL || Velion || Buasir Otak TV || Elz || Nugg3t Dude2 || Shadow world || Chakalmex Roblox || DEFUSYAH || Robox Crown  || ISSA_YT,16
9619492068,[UPD] Titan Fishing,2026-03-09,46731,8888,425.7467514203746,"Roblox Brainrot Tycoon Madness: Instant Hatches &amp; Extra Time Warps⏳ in My Fishing Brainrots! || Epic Roblox Brainrot Tycoon: Admin Time Warps &amp; Rare Egg Luck Boosts in My Fishing Brainrots! || New Op Method To Steal In My Fishing Brainrots!!💀 #fyp #fortnite   #fortnitebr #viral #brainrot || Mọi người câu được mấy con rồi?🤔 #roblox #xuhướng #shorts #titanfishing #lrex || Titan Fishing - câu cá vạn cân trên roblox, 5 chiêu thần thoại | Cacamua #roblox || Roblox – Lấy được cần câu xịn nhất game! Dùng chiêu 10 Câu Hợp Nhất phân thân cực bá | Titan Fishing || Tgaming ơi anh fix lại lỗi này đi [Titan fishing] Roblox || Tutorial mancing di pulau ke 1 sampai 4 TITAN FISHING | ROBLOX || Hướng Dẫn Chi Tiết Cách Lấy 3 Cần Câu Mythical? Xịn Từ Nhiệm Vụ Ẩn Cho Tân Thủ? | Titan Fishing || #3😚 TITAN FISH",Game On! || Game On! || Fish A Brainrot || L-Rex || CacaMua || Tấn Tài Gaming || Dũng Đào || Oneziis || Levini Gamer || TZHツ亗,18
9550364666,Survive Disasters for Brainrots!,2026-03-09,2556,1920,33.07301835220617,MY FISHING BRAINROTS || Weird glitch or secret buff in Survive Disasters for Brainrots!?!?!? || Swing Obby Brainrots || FISH FOR BRAINROTS! || I played survive disaster for brainrots again || ini beneran gampang? | survive disaster for brainrots | roblox || SURVIVE DISASTER FOR BRAINROTS GIVEAWAY!!! #roblox #brainrot #giveaway,PrimePulseYT || ProShadow || Sulfur Hub || RblxJayYT || Hatrick Pat || rdr indonesia | rdrindo || MostWantedPlayz,7
7089588429,(LIMITED x EVENT UPDATE 🐂) Drag Drive Simulator,2026-03-09,18274,12483,46.39109188496355,(MODIF x EVENT UPDATE 🏮) Drag Drive Simulator — Roblox Game of the Day #Shorts,Picurtchu,1
9774981774,[☀️ SINGULARITY] Re:Rangers X,2026-03-10,25776,9415,173.76666135627423,LIVE DE ROBLOX! 🔥 Atualização de JUJUTSU KAISEN no Anime Guardians e Anime Rangers X || HÀNH TRÌNH EVO GOJO VÀ LẤY SUKUNA &quot;SIÊU KHÓ&quot; ANIME RANGERS X | Noob To Pro Anime Rangers X UPDATE 1 || NEW JJK UPDATE TIERLIST - ANIME RANGERS X || BẢN CẬP NHẬP 1.0 Của Anime Ranger X Có Gì?? || 🔴Live อัปไรแต่เช้าาา | Roblox Anime Rangers X || Getting THE 0.1% SOVERIGN YUTA OKKOTSU In Anime Rangers X (Roblox) || The FASTEST Sukuna Calamity Mode Clear Guide | Anime Rangers X,ForyCraft || H.V.T mobile || Katsukei || BeKaGaming || Masayume || Luehs || Revex,7
6682487255,[ 🦾🏐] Anime Card Clash,2026-03-10,9753,7602,28.293324564288064,"How to Macro for Aizen / Yhwach! | Anime Guardians || NOVA UPDATE! ITADORI MÓDULO, AIZEN E YHWACH CHEGARAM + NOVO EVENTO INSANO | Anime Guardians || Yuji ตัวแต่เป็นเปอร์เซ็นเลือด | Roblox Anime Guardians || How to Macro the New Modulo Yuji Stage! | Anime Guardians || 🎬 Live - Nova Atualização do Anime Guardians || สอนฟาร์มด่านยูจิและไอเซ็น | Roblox Anime Guardians",Skid || ForyCraft || Masayume || Skid || Kr4ken || Masayume,6
9710064812,[NOW] Fly for Brainrots!,2026-03-10,13128,10294,27.524406236339793,Brainrots Swing Obby For Brainrots #roblox #games #new || SECRET Brainrot in Swing Obby for Brainrots on Roblox! || spiderman kalah ini... kita bawa pulang Noobini dulu di Ayunkan Obby for Brainrots #roblox || Brainrots Swing Obby For Brainrots #roblox #games #usa || PLAYING SWING OBBY FOR BRAINROTS PART 1 | Swing obby secrets + Free Celestial Brainrots | Roblox || Roblox Shorts #ReadyToReady - Swing Obby for Brainrots! (1) Tsunami Brainrot || Minha Base Atualizada de Swing Obby for Brainrots || Trading in swing obby for brainrot #swing #obby #for #brainrot #rblx #roblox #shrots #brainrot || Using ADMIN PRIVALEGES to Get the RAREST BRAINROTS in Roblox Swing Obby for Brainrots! || SWING DE OBBY PARA BRAINROTS NO ROBLOX,Kruzoxzz || Troas || sang landep || Kruzoxzz || NeonStrum || ReadyToReady || igvinipro || Rod4468_gd_and_vr || mykey || DulimPlay Raiz,86
4673599750,🐣 Murderers vs Sheriffs 2,2026-03-10,14801,7402,99.94596420128336,🔴valentines update murderers vs sheriffs 2 | Roblox mvs2🔴 || the update this year is so prettyy | #mvs2  murderers vs sheriffs 2 #roblox #murderersvssheriffs || This is how you deal with cheaters on Murderers vs Sheriffs Duels - Roblox || Murderers VS Sheriffs láda nyitogatás 2. rész || Playing Murders vs Sheriffs 2 on my noob acc!! || My First Video!! Murderers&#39; vs Sheriffs 2!! || Showcasing MVS2 Valentine’s Update !! | Roblox Murderers vs Sheriffs 2 | #roblox  || 💗ACTUALIZACION DE SAN VALENTIN MURDERS VS SHERIFFS 2💗// mvs2 || Murderers vs Sheriffs 2 |evo grind! || Murderers vs Sheriffs 2 |Valentines Update!,Cosmic Luck || rayne || Nazeef Islam || Citromka || ČakiKING || QuantumCracker || liakkuma || knucne || Blaze || Blaze,11
9294074907,[FPS] One Tap,2026-03-11,10028,6985,43.5647816750179,"MANTAP POLL!! Mancing Ikan TITAN Tapi Pakai SKILL Ultimate Keren 🐟🔥🗿 | Titan Fishing Indonesia || ftap 1v1 but with someone better than me || THE ONE TIME I FLIP MY COIN #forsaken #roblox #shorts #forsakenroblox || ¿CÓMO SUBIR DAÑO MASIVO? 😱 GUÍA Para NO TRABARSE | Anime Tacticals Roblox || ⚠️💎 ESTO ES IMPORTANTE | Gasta bien tus Gemas | Anime Tacticals Roblox || Solo Girl Zone Raid (x125 Free Stardust) | ROBLOX ALL STAR TOWER DEFENSE || [NEW] ADOTPME HOUSE CLONER #adoptmepets #adoptmeroblox #adoptmetrades #adoptmeupdate #delta #fypシ || Sailor Piece Might Be The BEST New One Piece Roblox Game || Someone gave me a og brainrot in swing obby for brainrot🤑🤑🤑🤑 || Eu avisei… não se aproxime, careca.  / #roblox #mm2 #shorts #murdermystery2",HaYoGo || Retray || Blue and MiniBlue || Corkyn || Corkyn || znn || WinScripts || Straw Hat Hub || Unknown gamerz || IG FPS Shorts,11
5822068820,☀️ KOYA DANCE STUDIO,2026-03-11,2332,1819,28.167078867820827,#audio,Conx,1
4165164803,Clip It 😂🎬👗,2026-03-11,5099,3987,27.890644594933534,Happy clip 😊 || live stream clips (cr : @Glowcko ) #mm2 #asmrkeyboard#ssmayyss || Cant see him (teeth)  #roblox #gaming #clips #rivals #shorts #wow || AR is the best primary prove me wrong #rivals #roblox #robloxrivals #edit #clips #knife #sniper || Rivals clips #rivals #roblox #gaming #sniperking #shorts || The BEST Juker? | Forsaken Clips | #forsaken #roblox #guest #clutch #janedoe #robloxforsaken || Slow this down for a sigma clip! #music #roblox #videogames #viral #popular #trending #youtubeshorts,Vicky9OPGaming || may >⩊< || Tazeratron || cheese rivals || RuN || Killer Jelly || Jeremy Garcia,7
